|title|score|id|subreddit|url|num_comments|body|created|Onion?
442|Nordstrom offering pre-dirtied jeans for $425|28436|67gf39|nottheonion|http://nbc4i.com/2017/04/25/nordstrom-offering-pre-dirtied-jeans-for-425/|2470||1493154461.0|0
443|Alberta police dog accidentally fires handgun found after parking lot fight|28421|7393zy|nottheonion|https://globalnews.ca/news/3776082/alberta-police-dog-accidentally-fires-handgun-found-after-parking-lot-fight/?|1109||1506732830.0|0
444|Thousands sign up to clean sewage because they didn't read the small print|28314|6n8gu1|nottheonion|https://www.theguardian.com/technology/2017/jul/14/wifi-terms-and-conditions-thousands-sign-up-clean-sewage-did-not-read-small-print?|1090||1500061043.0|0
445|Wife in UAE seeks divorce because husband loves her a lot, doesn't argue with her|28233|ctvwfx|nottheonion|https://m.khaleejtimes.com/uae/fujairah/wife-in-uae-seeks-divorce-because-husband-loves-her-a-lot-doesnt-argue-with-her|1831||1566501034.0|0
446|Hundreds rally to preserve right not to vaccinate children amid measles outbreak|28185|aoov83|nottheonion|https://www.cbsnews.com/news/washington-measles-outbreak-hundreds-rally-to-presesrve-not-to-vaccinate-children-2019-02-08/?fbclid=IwAR0KYS_mWsiXjZNt1omCII2wNKpDYEdXdbJ9ETeFx3woTStKaOZCGaIYnwA|4316||1549714377.0|0
447|Some Rivers Are So Drug-Polluted, Their Eels Get High on Cocaine|28176|8sjr4w|nottheonion|https://news.nationalgeographic.com/2018/06/european-eels-on-cocaine-polluted-rivers-science-environment-animals/|778||1529541252.0|0
448|With ingestible pill, you can track fart development in real time on your phone|28171|7p7ayo|nottheonion|https://arstechnica.com/science/2018/01/with-ingestible-pill-you-can-track-fart-development-in-real-time-on-your-phone/|933||1515535751.0|0
449|Man arrested for speeding in DeLorean at 88mph|28162|52vmfs|nottheonion|https://www.theguardian.com/film/2016/sep/15/man-arrested-for-speeding-in-delorean-at-88mph-back-to-the-future|947||1473966348.0|0
450|Police Use Taser on Woman, 87, Who Family Says Was Cutting Dandelions|28149|97rxxv|nottheonion|https://www.nbcnewyork.com/news/national-international/Taser-Woman-87-Cutting-Dandelions-491012761.html|1040||1534452145.0|0
451|Man Uses $1m Win To Finally Visit Doctor, Gets Terminal Cancer Diagnosis, Dies Weeks Later|28151|7uukqs|nottheonion|http://www.newsweek.com/new-york-lottery-winner-dies-weeks-after-scooping-jackpot-796957|2013||1517634760.0|0
452|Balenciaga's $2,145 bag is just like Ikea's 99 cent tote|28120|66haro|nottheonion|http://edition.cnn.com/2017/04/19/style/balenciaga-ikea-bag-trnd/|1991||1492719370.0|0
453|Trump’s press secretary has been fighting with Dippin’ Dots for 5 years|28109|5popob|nottheonion|http://www.avclub.com/article/trumps-new-press-secretary-five-year-running-feud--248859|1689||1485207176.0|0
454|"FEC declares Kid Rock couldn't have run for senate as ""Kid Rock,"" thus clearing him of federal complaints"|28105|a0ma2q|nottheonion|https://news.avclub.com/fec-declares-kid-rock-couldnt-have-run-for-senate-as-k-1830658934|1148||1543287506.0|0
455|Bitcoin mining could cancel out climate change efforts, scientists say|28085|9syzdl|nottheonion|https://www.cbc.ca/news/technology/bitcoin-mining-climate-change-1.4883647|2780||1541023243.0|0
456|Radio ad in Arkansas suggests ‘lynching’ if Democrats win|28070|9pkcam|nottheonion|https://apnews.com/4ef34c6d2f6245ff9f73564a0028145b|1965||1539988231.0|0
457|Ted Cruz tweets Zodiac Killer confession, extending the internet's favorite meme|28071|779qlz|nottheonion|http://www.newsweek.com/ted-cruz-zodiac-killer-twitter-688030|1155||1508390139.0|0
458|US Department of Education misspells name of civil rights activist W.E.B Du Bois — then misspells apology tweet|28064|5tthsl|nottheonion|http://www.abc.net.au/news/2017-02-13/us-education-department-misspells-web-du-bois-twitter/8265276|1322||1487029020.0|0
459|Florida Didn't Conduct Gun Background Checks for a Year Because an Employee Couldn't Log In|28024|8pqvcs|nottheonion|http://fortune.com/2018/06/08/florida-gun-background-checks-nics-log-in/|1204||1528553210.0|0
460|‘We will declare war’: Philippines’ Duterte gives Canada 1 week to take back garbage|28022|bgvrgq|nottheonion|https://globalnews.ca/news/5194534/philippines-duterte-declare-war-canadian-garbage/|2542||1556147389.0|0
461|Shopworker stole £1,500 worth of scratchcards — and didn't win ANYTHING|28010|aofxn6|nottheonion|https://www.greenocktelegraph.co.uk/news/17409802.shopworker-stole-1500-worth-of-scratchcards-and-didnt-win-anything/|723||1549656737.0|0
462|"Uber can't keep down accusations of ""vomit fraud"" against its drivers"|27973|91sx5h|nottheonion|https://news.avclub.com/uber-cant-keep-down-accusations-of-vomit-fraud-agains-1827846144|3208||1532562015.0|0
463|'You will never be forgotten' headstone left behind at airport|27915|6v53ze|nottheonion|http://www.herald.ie/news/you-will-never-be-forgotten-headstone-left-behind-at-airport-36051588.html|428||1503370504.0|0
464|Police: Flushing drugs could create Alabama ‘meth-gators’|27907|cdi6j8|nottheonion|https://www.al.com/news/huntsville/2019/07/police-flushing-drugs-could-create-alabama-meth-gators.html|1034||1563229952.0|0
465|Crematorium goes up in flames, bodies survive|27877|b0zji3|nottheonion|https://apnews.com/06d7cc62c7b44d7786b447b8d6c7a05a|377||1552594037.0|0
466|Man Survives Jumping Into Zoo's Elephant Enclosure as Animals Show Mercy and Escort Him Out|27796|9ii3p2|nottheonion|https://www.newsweek.com/man-survives-jumping-zoos-elephant-enclosure-animals-show-mercy-escort-him-1135419|830||1537826044.0|0
467|Youth leader facing sex charges claims teen was 'keen as a jellybean'|27775|6ofh1u|nottheonion|http://www.nzherald.co.nz/nz/news/article.cfm?c_id=1&objectid=11893053|1941||1500576765.0|0
468|Cabinet member praises absence of protest in a country where protests are illegal|27719|6cqmdk|nottheonion|http://money.cnn.com/2017/05/22/news/wilbur-ross-saudi-protests/index.html|901||1495521401.0|0
469|Adidas Apologizes After Sending ‘You Survived’ Email to Boston Marathon Finishers|27685|665h3e|nottheonion|http://time.com/4745066/adidas-boston-marathon-email/|1189||1492576187.0|0
470|Meanwhile, on Reddit, dudes can’t stop talking about fucking coconuts|27589|6t8dfy|nottheonion|http://www.avclub.com/article/meanwhile-reddit-dudes-cant-stop-talking-about-fuc-259298|956||1502572570.0|0
471|Laid-off state employees being called back to staff unemployment compensation centers|27563|7nuvst|nottheonion|http://www.pennlive.com/politics/index.ssf/2017/12/more_laid-off_workers_to_be_ca.html|1615||1515017657.0|0
472|Lindsey Graham prank called by Russians pretending to be Turkish defense minister|27550|dgdxxh|nottheonion|https://www.cnn.com/2019/10/10/politics/lindsey-graham-trump-hoax-call/index.html|800||1570822972.0|0
473|Africa Trade Meeting Has No Africans After US Visa Denials|27543|604f0u|nottheonion|http://www.voanews.com/a/african-trade-conference-canceled-after-visas-denied-african-delegates/3770907.html|1631||1489877266.0|0
474|Winnipeg's 1st toking and driving ticket issued 1 hour into legalization|27516|9p48oe|nottheonion|https://www.cbc.ca/news/canada/manitoba/cannabis-consumption-car-ticket-1.4867328|1590||1539851289.0|0
475|Rio diving pool—still green—now closed and smells like farts|27470|4xeuzf|nottheonion|http://arstechnica.com/science/2016/08/rio-diving-pool-still-green-now-closed-and-smells-like-farts/|2316||1471053470.0|0
476|Facebook apologizes after labeling part of Declaration of Independence 'hate speech'|27407|8wfvl2|nottheonion|https://www.cnn.com/2018/07/05/politics/facebook-post-hate-speech-delete-declaration-of-independence-mistake/index.html|2392||1530868012.0|0
477|Japanese security firm finds success with guards dressed as ninja|27385|7opvqv|nottheonion|https://www.japantimes.co.jp/news/2018/01/07/national/japanese-security-firm-finds-success-guards-dressed-ninja/#.WlHy0dJl-Uk|680||1515348839.0|0
478|Woman on trial for laughing during Jeff Sessions' confirmation hearing|27381|68vrp5|nottheonion|http://www.al.com/news/index.ssf/2017/05/woman_on_trial_for_laughing_at.html|3007||1493786393.0|0
479|More states allow sunscreen at schools without doctor’s OK|27374|6b6s80|nottheonion|https://apnews.com/f5c6c2d75a6c4a66a5e53725f567a0e4|2640||1494830855.0|0
480|John Kelly: 'The lack of an ability to compromise led to the Civil War'|27368|79uwyt|nottheonion|https://www.cnbc.com/2017/10/30/john-kelly-a-lack-of-ability-to-compromise-led-to-the-civil-war.html|5775||1509475610.0|0
481|Republican Congressman Says God Will 'Take Care Of' Climate Change|27345|6ejl2a|nottheonion|http://time.com/4800000/tim-walberg-god-climate-change/|2834||1496310032.0|0
482|Google CEO responds to Steve King's iPhone concerns: 'Congressman, iPhone is made by a different company'|27333|a5ahga|nottheonion|https://thehill.com/policy/technology/420838-google-ceo-responds-to-steve-king-concerns-about-granddaughters-iphone|1345||1544587973.0|0
483|Footballer accidentally thanks his wife and girlfriend in incredible man of the match speech|27325|60972o|nottheonion|http://www.telegraph.co.uk/football/2017/03/18/footballer-accidentally-thanks-wife-girlfriend-incredible-man/|1265||1489941763.0|0
484|Police: Fake cop busted pulling over real detectives on Long Island|27305|cscdmx|nottheonion|http://www.fox5ny.com/news/police-fake-cop-busted-pulling-over-real-detectives-on-long-island|865||1566219278.0|0
485|Lawmakers sick after drinking raw milk to celebrate legalizing raw milk|27291|49pqz3|nottheonion|http://www.oregonlive.com/today/index.ssf/2016/03/lawmakers_sick_after_drinking.html#incart_2box|3151||1457581541.0|0
486|Seattle Times apologizes for not knowing where Alabama, Mississippi are located|27222|6x7jm0|nottheonion|http://www.al.com/news/index.ssf/2017/08/seattle_times_apologizes_for_n.html#incart_river_home_pop?li_source=base|2150||1504222067.0|0
487|15-year-old activist accuses world leaders at UN climate conference of 'behaving like children'|27171|a354pr|nottheonion|https://thehill.com/policy/energy-environment/419719-15-year-old-activist-addresses-world-leaders-at-un-climate|942||1543987887.0|0
488|Boy sent home from anti-bullying day at Auckland school for not wearing enough pink|27160|bpnl7r|nottheonion|https://www.nzherald.co.nz/lifestyle/news/article.cfm?c_id=6&objectid=12232050|1320||1558102167.0|0
489|I acted as a man to get work - until I was accused of rape|27147|6baca8|nottheonion|http://www.bbc.co.uk/news/magazine-39705424|1428||1494883266.0|0
490|Uk surgeon finds 27 missing contact lenses in woman’s eye|27138|6ned5q|nottheonion|https://www.aop.org.uk/ot/science-and-vision/research/2017/07/14/uk-surgeon-finds-27-missing-contact-lenses-in-womans-eye|1517||1500126321.0|0
491|Netflix develops marijuana strains based on its original shows|27114|6w41qk|nottheonion|https://www.theguardian.com/tv-and-radio/2017/aug/25/netflix-marijuana-strains-original-shows|919||1503756289.0|0
492|11yo tries and fails to bribe Prime Minister Jacinda Ardern into funding dragon research|27049|bn3d4n|nottheonion|https://www.newshub.co.nz/home/politics/2019/05/11yo-tries-and-fails-to-bribe-prime-minister-jacinda-ardern-into-funding-dragon-research.html|565||1557548946.0|0
493|Venezuela's currency now worth so little shopkeepers weigh vast piles of notes instead of counting them|26967|5fec9y|nottheonion|http://www.independent.co.uk/news/world/americas/venezuelas-currency-hyper-inflation-oil-crisis-devalued-shop-keepers-weigh-notes-a7443596.html|3610||1480396833.0|0
494|Theatre-goer attacks ‘Roman soldier’ in a bid to rescue ‘Jesus’ from being crucified|26965|88o7es|nottheonion|http://www.news.com.au/lifestyle/real-life/wtf/theatregoer-attacks-roman-soldier-in-a-bid-to-rescue-jesus-from-being-crucified/news-story/8f11493f396dcbcb437e288f7d99fca6|1488||1522584197.0|0
495|New Zealand thrash-metal band will miss Salt Lake City show, because they’re too young to enter a bar|26892|9tattj|nottheonion|https://www.sltrib.com/artsliving/2018/10/31/new-zealand-thrash-metal/|940||1541117527.0|0
496|Man who stood in line to rob bank wearing mask and gloves wasn't queried because staff thought he may have skin condition|26873|a64xjv|nottheonion|https://www.telegraph.co.uk/news/2018/12/13/masked-man-able-rob-bank-manager-worried-challenging-case-had/|684||1544823877.0|0
497|Man Wants Town To Pay For Damage On His Lowered Car After Driving Over Speed Bumps|26826|bro1av|nottheonion|https://www.powernationtv.com/post/man-wants-town-to-pay-for-damage-on-his-lowered-car-after-driving-over-speed-bumps|2020||1558556006.0|0
498|Wal-Mart Asks Employees to Deliver Packages on Their Way Home|26795|6eqlq3|nottheonion|https://www.bloomberg.com/news/articles/2017-06-01/wal-mart-taps-employees-for-quick-deliveries-to-take-on-amazon|2841||1496387570.0|0
499|Black teenage woman, mistaken for machete-wielding black man, alleges police brutality|26776|6n0oip|nottheonion|http://www.bakersfield.com/news/black-teenage-girl-mistaken-for-machete-wielding-black-man-alleges/article_0ae15203-8291-5774-887b-95df9acfb2a8.html|4373||1499969128.0|0
500|Australian man patents the Hamdog - a hotdog and burger combo|26726|53nv4o|nottheonion|http://www.bbc.co.uk/newsbeat/article/37420032/australian-man-patents-the-hamdog---a-hotdog-and-burger-combo|2075||1474413700.0|0
501|Mother files federal lawsuit after son doesn’t make varsity team|26707|9js3ss|nottheonion|https://fox2now.com/2018/09/28/mother-files-federal-lawsuit-after-son-doesnt-make-varsity-team/|2168||1538207868.0|0
502|Sheriff: Man With Cocaine in Nostrils Tells Deputies It's Not His|26672|bzd55e|nottheonion|https://www.wnem.com/sheriff-man-with-cocaine-in-nostrils-tells-deputies-it-s/article_e822d1a8-f3df-5dc0-a95f-0d65e67370ea.html|587||1560291921.0|0
503|South Florida drivers would trade sex for less traffic, poll shows|26658|b0lwfe|nottheonion|https://www.local10.com/news/local/south-florida-drivers-would-trade-sex-for-less-traffic-poll-shows|950||1552511789.0|0
504|Chinese farmer unleashes 300 million hungry cockroaches to eat food waste|26646|8fqus7|nottheonion|https://www.thestar.com.my/news/nation/2018/04/29/chinese-farmer-unleashes-300-million-hungry-cockroaches-to-eat-food-waste/|1417||1525031056.0|0
505|Vancouver condo developers offer free wine or year’s supply of avocado toast to woo buyers in slowing market|26627|bywk7h|nottheonion|https://www.theglobeandmail.com/canada/british-columbia/article-vancouver-condo-developers-offer-free-wine-or-years-supply-of-avocado/|1788||1560193935.0|0
506|Video: SNES Classic Runs PSone Games Better Than The PlayStation Classic|26524|a8dps6|nottheonion|http://www.nintendolife.com/news/2018/12/video_snes_classic_runs_psone_games_better_than_the_playstation_classic|1075||1545450778.0|0
507|In a Leaked Memo, Apple Warns Employees to Stop Leaking Information|26500|8c17yu|nottheonion|https://www.bloomberg.com/news/articles/2018-04-13/apple-warns-employees-to-stop-leaking-information-to-media|393||1523671261.0|0
508|People stroll by as reporter ‘braces’ against wind. Weather Channel blames ‘wet grass’|26326|9gusc8|nottheonion|https://www.charlotteobserver.com/news/state/north-carolina/article218461770.html|1158||1537305753.0|0
509|'Lesbianism' listed as condition on North Carolina woman's medical chart|26291|5q336i|nottheonion|http://abc11.com/society/woman-lesbianism-listed-as-condition-on-medical-chart/1719764/|3182||1485378755.0|0
510|Martial arts academy posts how-to video for defending against Trump handshake|26267|5uf0r8|nottheonion|http://thehill.com/blogs/blog-briefing-room/news/319825-martial-arts-academy-posts-how-to-video-on-defending-against|1095||1487281841.0|0
511|Woman becomes a princess after marrying Ethiopian prince she met in nightclub|26256|76ytch|nottheonion|http://www.independent.ie/world-news/north-america/woman-becomes-a-princess-after-marrying-ethiopian-prince-she-met-in-nightclub-36236205.html|905||1508278561.0|0
512|Man crushed to death by forklift truck driven by pet dog|26248|9zqrbv|nottheonion|https://www.cnn.com/2018/11/23/uk/farmer-killed-forklift-dog-gbr-scli/index.html|657||1543026861.0|0
513|White St. Louis police officer shoots off-duty black officer|26233|6j5ujk|nottheonion|http://www.cbsnews.com/news/white-st-louis-police-officer-shoots-off-duty-black-officer/|3930||1498301365.0|0
514|Only 'thoughts and prayers' will stop evil behind shootings, Florida state senator says|26207|827l3g|nottheonion|http://www.tampabay.com/florida-politics/buzz/2018/03/05/only-thoughts-and-prayers-will-stop-evil-behind-shootings-florida-state-senator-says/|2040||1520299515.0|0
515|Woman 'secretly fattened up bridesmaids before wedding'|26184|9qnkqx|nottheonion|https://www.nzherald.co.nz/lifestyle/news/article.cfm?c_id=6&objectid=12147441|1712||1540318446.0|0
516|Crystal Palace fans accidentally vandalise their own team bus|26147|5wgegi|nottheonion|http://www.telegraph.co.uk/football/2017/02/27/crystal-palace-fans-accidentally-vandalise-team-bus/|839||1488226539.0|0
517|Japanese police arrest 74-year-old ninja thief suspect|26094|78pfbc|nottheonion|http://www.bbc.com/news/world-asia-41750080|887||1508982926.0|0
518|Tulsa Officer Acquitted of Killing Unarmed Black Man Holds Police Shooting 'Survival' Class|26063|9azojz|nottheonion|https://www.newsweek.com/tulsa-police-officer-betty-shelby-shooting-terence-crutcher-survival-class-1093039|2462||1535497542.0|0
519|Fans are legitimately upset that Michael Phelps didn't race a real shark|26044|6p6mtt|nottheonion|http://www.azcentral.com/story/entertainment/television/2017/07/24/michael-phelps-race-shark-week/503726001/|1757||1500906176.0|0
520|Man tweets Harry Potter book line-by-line to Piers Morgan|25954|5tomyy|nottheonion|http://news.sky.com/story/man-tweets-harry-potter-book-line-by-line-to-piers-morgan-10765829|1747||1486965768.0|0
521|Japanese zoo mourns anime-loving celebrity penguin|25946|765swt|nottheonion|http://www.bbc.co.uk/news/blogs-news-from-elsewhere-41608350|716||1507939800.0|0
522|Ruth Bader Ginsburg to Make Cameo Appearance in 'Lego Movie 2'|25932|ahr8qo|nottheonion|https://www.hollywoodreporter.com/heat-vision/ruth-bader-ginsburg-make-cameo-appearance-lego-movie-2-1177575?|1049||1547966730.0|0
523|'Shock' as Vatican document says it is 'not essential' that consecrated virgins be actual virgins|25927|8zjatl|nottheonion|https://calgaryherald.com/news/religion/shock-as-vatican-document-says-it-is-not-essential-that-consecrated-virgins-be-actual-virgins/wcm/ad7c637e-8562-43d9-93bb-2b4ac66a50cf/amp|1506||1531843770.0|0
524|Texas town holds .5K - not 5K - for underachievers|25900|8ezxh7|nottheonion|http://abc7ny.com/3391811/|879||1524745071.0|0
525|Chinese dating apps closed after women revealed to be robots|25859|7oyj38|nottheonion|http://www.bbc.com/news/blogs-news-from-elsewhere-42609353|1243||1515447294.0|0
526|Tillerson: 'I didn't want this job ... My wife told me I'm supposed to do this'|25727|60tpmj|nottheonion|http://www.cnbc.com/2017/03/22/tillerson-job-my-wife-told-me-im-supposed-to-do-this.html|2619||1490205711.0|0
527|Anger as Churchill's home is turned into Hitler HQ for Transformers 5|25696|54470h|nottheonion|https://www.theguardian.com/film/2016/sep/23/anger-churchill-home-turned-hitler-hq-transformers-5-michael-bay-swastika-flags|2698||1474658143.0|0
528|US Navy sailors instructed to 'clap like we're at a strip club' for Pence arrival|25689|bjikwr|nottheonion|https://www.cnn.com/2019/04/30/politics/us-navy-strip-club-mike-pence/index.html|1235||1556754127.0|0
529|Thieves replace Paraguay police rifles with toy replicas|25587|9anxvk|nottheonion|https://www.bbc.co.uk/news/world-latin-america-45320202|455||1535396129.0|0
530|Woman dies at 102, DirecTV charges early termination fee|25555|dc97xh|nottheonion|https://abc7news.com/society/woman-dies-at-102-directv-charges-early-termination-fee/5583488/|1258||1570046543.0|0
531|Man marks his ex-girlfriend's apology letter and sends it back to her|25548|5v4jvb|nottheonion|http://www.bbc.co.uk/newsbeat/article/39025091/man-marks-his-ex-girlfriends-apology-letter-and-sends-it-back-to-her|2090||1487626503.0|0
532|Second Spanish church falls prey to well-intentioned restorer|25533|8u00rq|nottheonion|https://www.theguardian.com/world/2018/jun/26/second-spanish-church-falls-prey-to-well-intentioned-restorer-st-george-ecce-homo-monkey-christ|1004||1530048631.0|0
533|Rapper Soulja Boy Releases New Handheld Game Console and It Looks Terrible|25516|a3km0s|nottheonion|https://www.newsweek.com/soulja-boy-new-handheld-game-console-souljagame-souljawatch-1245532?amp=1|1443||1544100045.0|0
534|Indian pilot returns home a hero and sparks mustache trend|25471|ax5jmg|nottheonion|https://www.cnn.com/2019/03/04/india/india-pilot-moustache-intl/index.html?|981||1551722990.0|0
535|Doctors save Canadian woman's life by removing her lungs for six days|25422|5qod4i|nottheonion|https://www.theguardian.com/world/2017/jan/25/canada-doctors-remove-lungs-transplant|1074||1485649635.0|0
536|Exclusive: Neo-Nazi and National Front organiser quits movement, opens up about Jewish heritage, comes out as gay|25418|770cty|nottheonion|https://www.channel4.com/news/neo-nazi-national-front-organiser-quits-movement-comes-out-as-gay-kevin-wilshaw-jewish-heritage|868||1508292141.0|0
537|Canada's immigration website crashes on election night|25413|5byhmw|nottheonion|http://www.ctvnews.ca/canada/canada-s-immigration-website-crashes-on-election-night-1.3152231|1888||1478695394.0|0
538|'Don't get shot by police' is goal of new advice in Arizona driver's manual|25400|6pait5|nottheonion|http://tucson.com/news/local/don-t-get-shot-by-police-is-goal-of-new/article_3d01739e-3cf1-5d88-a1cf-57f9648c6be2.html|2728||1500951368.0|0
539|Sacha Baron Cohen’s ‘Who Is America?’ Deleted Scene May Have Exposed Elite Pedophile Sex Ring|25373|a85ntt|nottheonion|https://www.newsweek.com/sacha-baron-cohen-who-america-deleted-scenes-dick-cheney-jeffrey-epstein-1267152|2035||1545389956.0|0
540|The USMC would like you to know that being in armed combat is exactly like playing Super Smash Bros.|25337|95wlde|nottheonion|https://news.avclub.com/the-usmc-would-like-you-to-know-that-being-in-armed-com-1828205858|1291||1533851382.0|0
541|Man searching for toilet stumbles across 49,000 year-old evidence of earliest human settlement in Australia|25335|5avoku|nottheonion|http://www.independent.co.uk/news/science/aboriginal-australian-searching-toilet-stumbles-49000-evidence-earliest-human-settlement-a7394731.html|639||1478191921.0|0
542|Man given $149 ticket for singing 90s dance song while driving|25317|783kwo|nottheonion|http://montreal.ctvnews.ca/man-given-149-ticket-for-singing-90s-dance-song-while-driving-1.3643520|1810||1508741297.0|0
543|Carjackers leave man's car behind after discovering it has a manual transmission|25278|58dp12|nottheonion|http://www.kmov.com/story/33431341/carjackers-leave-mans-car-behind-after-discovering-it-has-a-manual-transmission|3077||1476950229.0|0
544|Finance boss stole £370k from his firm and bought kittens|25265|8ts8vj|nottheonion|https://www.bbc.co.uk/news/uk-england-manchester-44604630|466||1529975433.0|0
545|Cyclist celebrates stage win a lap early, goes on to finish 148th|25264|6bva5t|nottheonion|http://www.stuff.co.nz/sport/other-sports/92454288/cyclist-celebrates-stage-win-a-lap-early-goes-on-to-finish-148th|494||1495131283.0|0
546|Bride cancels wedding, breaks up with fiancé after friends and family refuse to pay for $60G nuptials|25217|9arzv3|nottheonion|http://www.foxnews.com/lifestyle/2018/08/27/bride-cancels-wedding-breaks-up-with-fianc-after-friends-and-family-refuse-to-pay-for-60g-nuptials.html|2190||1535427025.0|0
547|Donald Trump Tweets SNL Is ‘Totally Biased’ After Sketch About His Twitter Habit|25218|5ggefz|nottheonion|http://time.com/4589807/snl-donald-trump-twitter/|1396||1480900325.0|0
548|'This Must Be Some Mistake,' Says Snowboarder After Winning Olympic Gold In Skiing|25173|7y5y19|nottheonion|https://www.npr.org/sections/thetorch/2018/02/17/586747375/-this-must-be-some-mistake-says-olympic-gold-medalist-in-womens-super-g|919||1518891986.0|0
549|Arizona postal worker cooks steak on dashboard to show ‘unsafe’ working conditions|25156|cneuga|nottheonion|https://kdvr.com/2019/08/06/arizona-postal-worker-cooks-steak-on-dashboard-to-show-unsafe-working-conditions/|1380||1565257078.0|0
550|"Sam Elliott on his Oscar nod: ""It's about fucking time"""|25118|aisgj6|nottheonion|https://news.avclub.com/sam-elliott-on-his-oscar-nod-its-about-fucking-time-1831960855?rev=1548188391115|661||1548224953.0|0
551|Alex Jones brags that he’s a “number one meme” during custody trial|25110|66pv0a|nottheonion|http://www.avclub.com/article/alex-jones-brags-hes-number-one-meme-during-custod-254069|2120||1492816961.0|0
552|Gold Coast police urging victims to drop complaints to improve crime statistics|25087|67n7cv|nottheonion|https://www.theguardian.com/australia-news/2017/apr/26/gold-coast-police-urging-victims-to-drop-complaints-to-improve-statistics|1034||1493230471.0|0
553|Viral Chinese video game measures which players can clap fastest for President Xi Jinping|25067|77flfz|nottheonion|https://www.cnbc.com/2017/10/19/tencent-game-users-clap-chinese-president-xi-jinping-party-congress-speech.html|1217||1508459802.0|0
554|King of West African tribe returns to landscaping job in Canada|24952|53hx5c|nottheonion|http://www.ctvnews.ca/canada/king-of-west-african-tribe-returns-to-landscaping-job-in-canada-1.3077848|1145||1474325672.0|0
555|Theme park ride based on Princess Diana's fatal crash opens tomorrow|24918|bsfyp4|nottheonion|https://www.devonlive.com/news/uk-world-news/theme-park-ride-based-princess-2903052|1304||1558727472.0|0
556|Bill would block computers bought in S.C. from accessing porn|24824|5j6brj|nottheonion|http://www.charlotteobserver.com/news/local/article121673402.html|5337||1482182228.0|0
