|title|score|id|subreddit|url|num_comments|body|created|Onion?
887|Investigatory Powers Bill: Politicians exempt themselves from new wide-ranging spying laws|16747|5fymba|nottheonion|http://www.independent.co.uk/life-style/gadgets-and-tech/news/investigatory-powers-bill-a7447781.html|998||1480649704.0|0
888|Sharks love jazz but are stumped by classical, say scientists|16751|8idw1k|nottheonion|https://www.theguardian.com/music/2018/may/10/sharks-love-jazz-macquarie-university-sydney?|434||1525977327.0|0
889|Adblock Plus finds the end-game of its business model: Selling ads|16717|52lp83|nottheonion|http://arstechnica.com/tech-policy/2016/09/adblock-plus-starts-selling-ads-but-only-acceptable-ones/|1847||1473816363.0|0
890|Alligators were given ketamine and headphones to study dinosaur hearing|16698|b39ztd|nottheonion|https://mixmag.net/read/alligators-ketamine-and-headphones-to-study-dinosaurs-news/|544||1553103674.0|0
891|Man reported to police for ‘revenge fart’ after woman refused to have sex|16601|4coxxw|nottheonion|http://60abc.com/man-reported-to-police-for-revenge-fart-after-woman-refused-to-have-sex/|883||1459436366.0|0
892|Mum delivers her own baby after watching YouTube tutorial|16561|8fk14d|nottheonion|http://www.heart.co.uk/lifestyle/relationships/parenting/mum-delivers-own-baby-youtube-tutorial/|1007||1524952637.0|0
893|Japanese Father Kills 12-Year-Old Son For Not Studying|16552|4zaj5p|nottheonion|http://time.com/4462601/japan-father-stabs-son-study-exam/|2253||1472037896.0|0
894|Rick Perry thought he was speaking to the Ukrainian prime minister for 22 minutes|16543|6po9q6|nottheonion|http://www.cbsnews.com/news/rick-perry-thought-he-was-speaking-to-the-ukrainian-prime-minister-for-22-minutes/|733||1501106873.0|0
895|DJ fined for playing 'F**k Tha Police' while cops raided a bar|16520|4aohlq|nottheonion|http://www.independent.co.uk/arts-entertainment/music/news/dj-fined-for-playing-fk-tha-police-while-cops-raided-a-bar-a6933891.html|1091||1458173314.0|0
896|False alarm: Knife-wielding man on Metro revealed to be expert ham cutter|16453|b6w7uh|nottheonion|https://elpais.com/elpais/2019/03/20/inenglish/1553072631_284878.html|646||1553888451.0|0
897|Marijuana is kosher for Passover, leading rabbi rules|16443|4fxqt9|nottheonion|http://www.independent.co.uk/news/world/middle-east/marijuana-is-kosher-for-passover-leading-rabbi-rules-a6995761.html|697||1461346667.0|0
898|Kushner 'occasionally' used personal email id for White House business, clarifies lawyer|16420|729gmr|nottheonion|http://www.abplive.in/world-news/kushner-occasionally-used-personal-email-id-for-white-house-business-clarifies-lawyer-584402|1280||1506333166.0|0
899|She called 911 when her daughter was attacked. Detroit police arrived 4 days later.|16391|9web23|nottheonion|https://www.wxyz.com/news/local-news/investigations/she-called-911-when-her-daughter-was-attacked-detroit-police-arrived-4-days-later|1131||1542060545.0|0
900|Parents travel from India to help son beat wife, say deputies|16329|6xtwtz|nottheonion|http://www.tampabay.com/news/publicsafety/crime/parents-travel-from-india-to-help-son-beat-wife-say-deputies/2336101|324||1504483002.0|0
901|Woman aboard a plane that skidded into a river says the landing 'didn't feel right'|16292|bkjto9|nottheonion|https://www.cnn.com/2019/05/04/us/military-plane-crash-bormann-passenger/index.html|612||1556994720.0|0
902|Arizona so hot weather map almost runs out of colors|16284|6iy52x|nottheonion|http://www.mlive.com/weather/index.ssf/2017/06/arizona_so_hot_weather_map_alm.html|1228||1498211014.0|0
903|‘Make better choices’: Endangered Hawaiian monk seals keep getting eels stuck up their noses and scientists want them to stop|16277|a430zz|nottheonion|https://www.boston.com/news/animals/2018/12/07/hawaiian-monk-seals-eels-noses|322||1544238736.0|0
904|Stanford rape case: Sex offender's dad says 6 months is too harsh for '20 minutes of action'|16249|4mwl4x|nottheonion|http://www.cbc.ca/news/trending/stanford-swimmer-brock-turner-sexual-assault-father-reacts-1.3618571|4205||1465292197.0|0
905|Shawnee Mission parents question school district’s purchase of semi-automatic rifles|16247|6grp1y|nottheonion|http://www.kansascity.com/news/local/article155553854.html|3105||1497296589.0|0
906|All aboard the Flat Earth cruise – just don’t tell them about nautical navigation|16217|afad6j|nottheonion|https://www.theguardian.com/science/2019/jan/09/flat-earth-cruise-nautical-navigation|1010||1547348044.0|0
907|Facebook admits it did not read terms of the app that harvested data of 87 million|16209|8f2114|nottheonion|https://www.cnbc.com/2018/04/26/facebook-cto-admits-firm-didnt-read-terms-of-aleksandr-kogans-app.html|251||1524772315.0|0
908|Russia's Military Just Bought Five Bottlenose Dolphins and It Won't Say Why|16215|4g7vid|nottheonion|http://www.nbcnews.com/news/world/russia-s-military-just-bought-five-bottlenose-dolphins-it-won-n560471|1268||1461527548.0|0
909|Kenya cancels elections after too many voters turn up|16211|66z9o5|nottheonion|http://www.dw.com/en/kenya-cancels-elections-after-too-many-voters-turn-up/a-38548489|451||1492934509.0|0
910|Instant noodles can make babies gay, claims Indonesia mayor|16163|49uppq|nottheonion|http://www.dnaindia.com/world/report-instant-noodles-can-make-babies-gay-claims-indonesia-mayor-2183054|1166||1457663052.0|0
911|Police called to South Euclid Taco Bell due to dispute over 'Fire' or 'Mild' sauce|16133|6111uj|nottheonion|http://www.newsnet5.com/news/local-news/oh-cuyahoga/police-called-to-south-euclid-taco-bell-due-to-dispute-over-fire-or-mild-sauce|1267||1490293848.0|0
912|THOUSANDS of red Skittles spill onto Dodge County highway|16127|5owvw0|nottheonion|http://fox6now.com/2017/01/18/thousands-of-red-skittles-spill-onto-dodge-county-highway/|1337||1484865430.0|0
913|Inflated Duck Lands Russian Activist In Jail|16024|80lmw5|nottheonion|https://themoscowtimes.com/news/inflated-duck-lands-russian-activist-jail-60633|396||1519758371.0|0
914|Tobacco giant says it wants to give up cigarettes|15984|7oaq48|nottheonion|http://www.stltoday.com/news/tobacco-giant-says-it-wants-to-give-up-cigarettes/article_fa11620a-54e8-5e62-9adb-85dcf4db455b.html|1204||1515181680.0|0
915|Jamaica may legalise weed and get rid of the Queen|15956|4evpov|nottheonion|http://www.independent.co.uk/news/world/americas/jamaica-may-legalise-weed-and-get-rid-of-the-queen-a6985156.html|313||1460735548.0|0
916|Police handing out blunt knives to domestic violence victims to reduce stabbings in the home|15950|bznqaq|nottheonion|https://www.nottinghampost.com/news/nottingham-news/police-handing-out-blunt-knives-2964343|1500||1560350218.0|0
917|Virginia man spends $1,000 to deliver 300,000 pennies to Lebanon DMV|15935|5nmiqq|nottheonion|http://www.heraldcourier.com/news/virginia-man-spends-to-deliver-pennies-to-lebanon-dmv/article_7ce44fc2-ea36-5638-9358-25bc5d01a5dd.html|2098||1484288805.0|0
918|UPS delivers assault rifle instead of child's Christmas gift|15924|5ipxxw|nottheonion|http://www.whec.com/news/ups-delivers-assault-rifle-christmas-gift/4346870/?cat=565%20%20|2844||1481942822.0|0
919|'Why not Texit?': Texas nationalists look to the Brexit vote for inspiration|15908|4pt9qe|nottheonion|https://www.theguardian.com/us-news/2016/jun/19/texas-secession-movement-brexit-eu-referendum|6177||1466901899.0|0
920|Library cat outlasts councilman that wanted him gone|15877|5itgrp|nottheonion|http://www.cbsnews.com/news/library-cat-outlasts-councilman-that-wanted-him-gone/|507||1481989172.0|0
921|Parents Sold 18-Day-Old Daughter to Buy an iPhone, Had “No Idea It Is Illegal”|15823|49iimt|nottheonion|http://news.softpedia.com/news/parents-sold-18-day-old-daughter-to-buy-an-iphone-had-no-idea-it-is-illegal-501486.shtml|1734||1457473180.0|0
922|US government blocks League of Legends in Syria and Iran amid escalating tensions|15818|c3vuzd|nottheonion|https://dotesports.com/league-of-legends/news/us-government-blocks-league-in-syria-and-iran|1230||1561272561.0|0
923|Chinese man tired of wife’s complaining invents smart robot cooker|15791|8e7dy7|nottheonion|https://news.cgtn.com/news/3d3d414f3549444d77457a6333566d54/share_p.html|509||1524471227.0|0
924|50 Cent's lawyers tell judge that he must appear rich because many rap fans are poor and need inspiration|15758|4a70ud|nottheonion|http://thesource.com/2016/03/11/audio-50-cents-lawyers-tell-judge-that-he-must-appear-rich-because-many-rap-fans-are-poor-and-need-inspiration/|1424||1457871741.0|0
925|Bono: 'Music has gotten very girly'|15734|7mmnyy|nottheonion|http://www.bbc.com/news/entertainment-arts-42502453?ocid=socialflow_twitter|3787||1514497519.0|0
926|New York monument honors victims of giant octopus attack that never occurred|15718|55icxg|nottheonion|https://www.theguardian.com/us-news/2016/oct/01/new-york-staten-island-ferry-octopus-attack-fake-monument|404||1475446224.0|0
927|Stevens County man accused of posing as Mexican drug cartel to extort members of his own right-wing militia|15687|bk0y08|nottheonion|https://www.spokesman.com/stories/2019/may/02/warrant-issued-for-stevens-county-man-accused-of-p/|473||1556864366.0|0
928|Yik Yak fires 30 of 50 employees, still has no business model|15688|5hpkfk|nottheonion|http://arstechnica.com/business/2016/12/yik-yak-fires-30-of-50-employees-still-has-no-business-model/|1154||1481481807.0|0
929|Arkansas legislator proposes cutting lunch funding from schools that struggle to improve reading skills|15608|atn7zp|nottheonion|https://wtkr.com/2019/02/21/arkansas-legislator-proposes-cutting-lunch-funding-from-schools-that-struggle-to-improve-reading-skills/|1029||1550900305.0|0
930|Parrot who allegedly witnessed murder says 'Don't f***ing shoot'|15575|4md6bp|nottheonion|http://www.independent.co.uk/news/world/americas/parrot-who-allegedly-witnessed-murder-cant-stop-saying-dont-fing-shoot-a7063646.html|922||1464993754.0|0
931|Paralympian glues himself to the top of British Airways jet as Extinction Rebellion invades London City airport|15571|dg7rqc|nottheonion|https://www.news.com.au/technology/environment/climate-change/paralympian-glues-himself-to-the-top-of-british-airways-jet-as-extinction-rebellion-invades-london-city-airport/news-story/9eae7bda7f174ab53152840377d77cdd|1553||1570785329.0|0
932|There's Now an App That Tells You If McDonald's Ice Cream Machine Is Broken|15537|7bg4na|nottheonion|http://time.com/5011921/mcdonalds-app-broken-ice-cream-machine/|545||1510116570.0|0
933|ISIS bans women from wearing burkas after chiefs attacked by veiled assassins|15527|51dr2b|nottheonion|http://www.news.com.au/world/middle-east/isis-bans-women-from-wearing-burkas-after-chiefs-attacked-by-veiled-assassins/news-story/5356534a06f3213389835f34281ecf80|829||1473169158.0|0
934|Stockton program would pay men not to shoot each other|15464|6ln5df|nottheonion|http://www.kcra.com/article/stockton-program-would-pay-men-not-to-shoot-each-other/10267025|1235||1499389508.0|0
935|Universal finds pirated copy of Jurassic World seeded from its own servers|15449|3ebxpm|nottheonion|http://www.theguardian.com/technology/2015/jul/23/universal-pirated-copy-jurassic-world-seeded-from-its-own-servers|1235||1437693418.0|0
936|Sexploits of Diego the Tortoise save Galapagos species|15412|52qid3|nottheonion|http://phys.org/news/2016-09-sexploits-diego-tortoise-galapagos-species.html|552||1473889118.0|0
937|'C U in the NT' tourism slogan causes social media stir|15408|5bqwne|nottheonion|http://www.abc.net.au/news/2016-11-08/c-u-in-the-nt-tourism-slogan-causes-social-media-stir/8004430|828||1478604142.0|0
938|You Can Actually Bet on a Dildo Being Thrown on the Field in Patriots vs Bills Game – Odds Favor Yes|15400|d9uo5k|nottheonion|https://www.sportsbettingdime.com/news/nfl/bet-dildo-thrown-on-field-patriots-bills-odds/|452||1569583563.0|0
939|Plastic surgery addict left with permanent erection after botched nose job|15387|6yt8nu|nottheonion|http://www.news.com.au/lifestyle/beauty/cosmetic-surgery/plastic-surgery-addict-left-with-permanent-erection-after-botched-nose-job/news-story/f40c80a357fc1a7c5de46a35e4b75eaa|1439||1504883314.0|0
940|"""You don't have to do this"" Prince George man tells black bear as it tries to drown him."|15383|d10pn6|nottheonion|https://www.mapleridgenews.com/news/you-dont-have-to-do-this-prince-george-man-tells-black-bear-as-it-tries-to-drown-him/|599||1567914620.0|0
941|Squirrel eats mini ice cream cones every day at ice cream shop|15302|65j8n1|nottheonion|http://www.nbc15.com/content/news/Squirrel-eats-mini-ice-cream-cones-every-day-at-ice-cream-shop-419496813.html|372||1492294135.0|0
942|University student who filmed flatmates in the shower asks for privacy|15312|8fiwbv|nottheonion|https://www.smh.com.au/national/nsw/university-student-who-filmed-flatmates-in-the-shower-asks-for-privacy-20180427-p4zc1w.html|623||1524937103.0|0
943|New Environment Secretary backs fox hunting, selling off forests, and opposes climate change measures|15287|4su16k|nottheonion|http://www.independent.co.uk/news/uk/politics/andrea-leadsom-environment-secretary-andrea-leadsom-fox-hunting-selling-off-forests-climate-change-a7137066.html|1443||1468541177.0|0
944|Brexit ferry contract worth £13.8 million ‘awarded to company with no ships’|15269|ab17g6|nottheonion|https://www.itv.com/news/2018-12-30/brexit-ferry-contract-awarded-to-company-with-no-ships/|740||1546241793.0|0
945|Bus drivers' union threatens strike over driverless buses|15260|9h7zwg|nottheonion|https://www.nbc4i.com/news/politics/ohio-statehouse-newsroom/bus-drivers-union-threatens-strike-over-driverless-buses/1457778544|2076||1537412538.0|0
946|School forced to apologise after pupils told to write their own suicide notes|15189|6j8416|nottheonion|http://www.independent.co.uk/news/education/education-news/school-children-london-school-told-to-write-suicide-notes-macbeth-tallis-school-shakespeare-play-a7806071.html|862||1498339141.0|0
947|Texas Concludes Record-Breaking Streak of Not Executing People|15168|564wzz|nottheonion|http://www.houstonpress.com/news/texas-concludes-record-breaking-streak-of-not-executing-people-8833082|2120||1475782310.0|0
948|China's goths protest after woman told to remove 'distressing' make-up on subway|15091|b2uyoe|nottheonion|https://www.theguardian.com/world/2019/mar/19/chinas-goths-protest-after-woman-told-to-remove-distressing-make-up-on-subway|685||1553014010.0|0
949|Scottish banks promise their notes are vegan|15084|5fp1n0|nottheonion|http://www.scottishfinancialnews.com/11090/scottish-banks-promise-their-notes-are-vegan/|1270||1480532792.0|0
950|American Airlines Pilots are Complaining That Their Uniforms Are Making Them Sick|15068|66vj3f|nottheonion|http://fortune.com/2017/04/20/american-airlines-pilots-uniforms-itchy/|860||1492889974.0|0
951|TSA jails innocent traveler when he asks to file a complaint|15068|2ururc|nottheonion|http://www.philly.com/philly/news/20150204_TSA_jails_innocent_traveler_when_he_asks_to_file_a_complaint.html|1421||1423099778.0|0
952|"Trump asks black reporter to ""set up the meeting"" with Congressional Black Caucus"|15060|5uhjbc|nottheonion|http://www.cbsnews.com/news/trump-asks-reporter-to-set-up-the-meeting-with-congressional-black-caucus/|2575||1487304982.0|0
953|There is no internet censorship in China, says China’s top censor|15040|3w236o|nottheonion|https://www.hongkongfp.com/2015/12/09/there-is-no-internet-censorship-in-china-says-chinas-top-censor/|1155||1449684992.0|0
954|"The head of the anti-corruption campaign group ""Transparent Chile"" just resigned after being implicated in the Panama Papers scandal."|15033|4degx7|nottheonion|http://www.reuters.com/article/panama-tax-chile-idUSL2N1771Z1|477||1459851949.0|0
955|Prove you’re not Saddam Hussein, Apple tells customer|15029|5a0qa1|nottheonion|http://www.timesofisrael.com/prove-youre-not-saddam-hussein-apple-tells-customer/|814||1477781006.0|0
956|Police admit they cannot stop Austrian woman who has scratched 1,000 cars|15013|4yurk4|nottheonion|http://www.independent.co.uk/news/world/europe/car-scratching-woman-austria-police-admit-they-cannot-stop-her-a7202236.html|1492||1471813622.0|0
957|Jeb Bush Speech Denouncing Lobbyists Was Organized By Corporate Lobbying Group|14975|3e77mu|nottheonion|http://www.ibtimes.com/election-2016-jeb-bush-speech-denouncing-lobbyists-was-organized-corporate-lobbying-2018550|1569||1437603334.0|0
958|Weatherman pronounces 'Llanfairpwllgwyngyllgogerychwyrndrob-wllllantysiliogogogoch' flawlessly on live TV|14974|3kemk2|nottheonion|http://www.cbc.ca/news/trending/weatherman-liam-dutton-pronounces-llanfairpwllgwyngyllgogerychwyrndrobwllllantysiliogogogoch-perfectly-1.3221414|1439||1441924951.0|0
959|Indiana town's entire police force quits|14942|5idehf|nottheonion|http://www.indystar.com/story/news/fox59/2016/12/14/indiana-towns-entire-police-force-quits/95415740/|1570||1481780496.0|0
960|Churches would be more popular if they stopped 'banging on' about God, Sir Simon Jenkins says|14924|6fdixh|nottheonion|http://www.telegraph.co.uk/news/2017/06/04/churches-would-popular-stopped-banging-god-sir-simon-jenkins/|1270||1496690084.0|0
961|Oregon 'terrorists' don't plan siege very well, put out plea for snacks and supplies|14903|3zfw7q|nottheonion|http://i100.independent.co.uk/article/oregon-terrorists-dont-plan-siege-very-well-put-out-plea-for-snacks-and-supplies--ZJglh9sRjx|4917||1451960058.0|0
962|Pakistan makes nuclear threat to Israel, in response to fake news|14883|5k3g8r|nottheonion|http://www.timesofisrael.com/pakistani-defense-minister-in-nuclear-threat-to-israel/|1240||1482621577.0|0
963|'No Way To Prevent This,’ Says Only Nation Where This Regularly Happens|34989|7b0y34|TheOnion|https://www.theonion.com/no-way-to-prevent-this-says-only-nation-where-this-r-1820163660?utm_content=Main&utm_campaign=SF&utm_source=Twitter&utm_medium=SocialMarketing|3043||1509950776.0|1
964|Trump Warns Removing Confederate Statues Could Be Slippery Slope To Eliminating Racism Entirely|27432|7to2ak|TheOnion|https://politics.theonion.com/trump-warns-removing-confederate-statues-could-be-slipp-1819592904|1882||1517211100.0|1
965|‘No Way To Prevent This,’ Says Only Nation Where This Regularly Happens|21134|7xl7h3|TheOnion|https://www.theonion.com/no-way-to-prevent-this-says-only-nation-where-this-r-1819580358|1200||1518670240.0|1
966|Roy Moore Retires From Politics To Spend More Quality Time With Someone's Kid|18069|7jgh6i|TheOnion|https://politics.theonion.com/roy-moore-retires-from-politics-to-spend-more-quality-t-1821235915|126||1513164985.0|1
967|Mike Pence Disappointed In The 200,000 Husbands And Fathers Who Permitted Women To Attend March|16743|5pbaag|TheOnion|http://www.theonion.com/article/mike-pence-disappointed-200000-husbands-and-father-55116?utm_medium=RSS&utm_campaign=feeds|332||1485043698.0|1
968|Mike Pence Disappointed God Has Never Asked Him To Kill One Of Own Children|15843|5se5mg|TheOnion|http://www.theonion.com/article/mike-pence-disappointed-god-has-never-asked-him-ki-55239?utm_medium=RSS&utm_campaign=feeds|187||1486415647.0|1
969|Logan Paul: 'I Didn’t Realize People Who Commit Suicide Kill Themselves'|14824|7t7e6e|TheOnion|https://www.theonion.com/logan-paul-i-didn-t-realize-people-who-commit-suicide-1822460035|252||1517027212.0|1
970|RNC: 'We Warned You Gay Marriage Would Be A Slippery Slope Toward Accepting Pedophilia'|14006|7i9in3|TheOnion|https://politics.theonion.com/rnc-we-warned-you-gay-marriage-would-be-a-slippery-slo-1821095609|231||1512708780.0|1
971|‘No Way To Prevent This,’ Says Only Nation Where This Regularly Happens|12493|73sur4|TheOnion|http://www.theonion.com/article/no-way-prevent-says-only-nation-where-regularly-ha-51444?utm_source=Twitter&utm_medium=SocialMarketing&utm_campaign=Pic:1:Default|1463||1506980833.0|1
972|Paul Ryan Confident American People Will Warm Up To Tax Plan Once They Realize Life A Cruel And Meaningless Farce|11435|7lgsq8|TheOnion|https://politics.theonion.com/paul-ryan-confident-american-people-will-warm-up-to-tax-1821509050|378||1513969555.0|1
973|Heartwarming: When This McDonald’s Employee Had To Walk 20 Miles To Work Because He Couldn’t Afford A Car, The CEO Of McDonald’s Drove Alongside Him To Cheer Him On|10568|9bkdix|TheOnion|https://www.clickhole.com/heartwarming-when-this-mcdonald-s-employee-had-to-walk-1828134369|112||1535670119.0|1
974|Panicked Donald Trump Jr. Tries To Cover Up Contact With WikiLeaks By Deleting Firefox Icon From Desktop|10143|7ijh32|TheOnion|https://politics.theonion.com/panicked-donald-trump-jr-tries-to-cover-up-contact-wit-1821133627|151||1512810163.0|1
975|Political Scientists Baffled By Trump’s Ability To End Something He Had No Control Over Just Days Ago|9087|8smqh3|TheOnion|https://politics.theonion.com/political-scientists-baffled-by-trump-s-ability-to-end-1827000942|338||1529563442.0|1
976|Gay Conversion Therapists Claim Most Patients Fully Straight By The Time They Commit Suicide|9047|7ui11u|TheOnion|https://www.theonion.com/gay-conversion-therapists-claim-most-patients-fully-str-1819577679|90||1517512099.0|1
977|"""No way to prevent this"" says only nations where this regualrly happens"|7172|9ajm74|TheOnion|https://www.theonion.com/no-way-to-prevent-this-says-only-nation-where-this-r-1820163660?utm_content=Main&utm_campaign=SF&utm_source=Twitter&utm_medium=SocialMarketing|488||1535351423.0|1
978|‘Nothing Is More Attractive Than Confidence,’ Says Woman Who Has Apparently Never Seen Sonic The Hedgehog Cosplay|7066|8ebmcr|TheOnion|https://local.theonion.com/nothing-is-more-attractive-than-confidence-says-woma-1825465584|58||1524520512.0|1
979|‘No Way To Prevent This,’ Says Only Nation Where This Regularly Happens|6310|8keat4|TheOnion|https://www.theonion.com/no-way-to-prevent-this-says-only-nation-where-this-r-1823016659|412||1526688261.0|1
980|My Doctor Told Me I Should Vaccinate My Children, But Then Someone Much Louder Than My Doctor Told Me I Shouldn’t|5156|7mzst1|TheOnion|http://www.clickhole.com/blogpost/my-doctor-told-me-i-should-vaccinate-my-children-t-653?utm_content=Main&utm_campaign=SF&utm_source=Facebook&utm_medium=SocialMarketing|86||1514640227.0|1
981|I Won't Have My Daughter Bringing A Black Man Into This House Until I've Tidied Up And Created A Welcoming Environment|5092|7oaio6|TheOnion|https://www.theonion.com/i-wont-have-my-daughter-bringing-a-black-man-into-this-1819584636|78||1515178738.0|1
982|‘No Way To Prevent This,’ Says Only Nation Where This Regularly Happens|4051|9sc79g|TheOnion|https://www.theonion.com/no-way-to-prevent-this-says-only-nation-where-this-r-1823016659|450||1540840923.0|1
983|‘The Onion’ Proudly Stands With The Media As The Enemy Of The People|3346|9440up|TheOnion|https://www.theonion.com/the-onion-proudly-stands-with-the-media-as-the-enemy-1828068740?utm_medium=SocialMarketing&utm_content=Main&utm_source=Twitter&utm_campaign=SF|88||1533278354.0|1
984|‘Paw Patrol’ Writers Defend Episode Where German Shepherd Cop Shoots Unarmed Black Lab 17 Times In Back|3247|983ymw|TheOnion|https://entertainment.theonion.com/paw-patrol-writers-defend-episode-where-german-shephe-1828419524|51||1534553889.0|1
985|Liberal Hypocrisy: When Obama Was President Democrats Were Okay With Him Being President, But When Trump Is President Suddenly It’s Wrong To Be President?|2858|98umot|TheOnion|https://patriothole.clickhole.com/liberal-hypocrisy-when-obama-was-president-democrats-w-1828462533|73||1534808145.0|1
986|Next-Level Gaming: The New ‘Call Of Duty’ Will Penalize Players For Shooting Nazis Who Are Actually Very Fine People|2761|6ucokv|TheOnion|http://www.clickhole.com/article/next-level-gaming-new-call-duty-will-penalize-play-6513|35||1503029526.0|1
987|Hardcore Gamers Only: ‘Overwatch’ Is Increasing Its Difficulty By Adding A Senior-Citizen Character That’s A Financial Drain And Emotional Burden On Their Whole Team|2756|8y0ob1|TheOnion|https://www.clickhole.com/hardcore-gamers-only-overwatch-is-increasing-its-dif-1826496642|34||1531352659.0|1
988|Going Too Far?: Nintendo Has Responded To Complaints That Marth Is Too Overpowered In ‘Smash’ By Giving Him Fibromyalgia|2730|cyrc06|TheOnion|https://ogn.theonion.com/going-too-far-nintendo-has-responded-to-complaints-th-1837812557|56||1567470966.0|1
989|When This Boy With A Colostomy Bag Said He Was Sad There Were No Superheroes Like Him, Marvel Told Him It’s Absolutely Crucial For Superheroes To Have A Functioning Anus|2686|9b91tu|TheOnion|https://lifestyle.clickhole.com/when-this-boy-with-a-colostomy-bag-said-he-was-sad-ther-1825122909|46||1535576293.0|1
990|I Was Never Able To Accept My Son’s Autism Until I Monetized It Through Blogging|2595|4s6lte|TheOnion|http://www.clickhole.com/blogpost/i-was-never-able-accept-my-sons-autism-until-i-mon-3532|11||1468203056.0|1
991|Mom Wants To Know If You Could Use Grandma’s Antique, 12-Person Dining Room Table In Your Studio Apartment|2585|ag9o46|TheOnion|https://local.theonion.com/mom-wants-to-know-if-you-could-use-grandma-s-antique-1-1831765783|23||1547595202.0|1
992|Inconsolable Jeff Sessions Tries To Commit Suicide By Smoking Joint|2438|ab6leb|TheOnion|https://politics.theonion.com/inconsolable-jeff-sessions-tries-to-commit-suicide-by-s-1826462420?utm_source=Twitter&utm_medium=SocialMarketing&utm_content=Main&utm_campaign=SF|24||1546287097.0|1
993|Marco Rubio Still Rock-Hard Days After Being Publicly Humiliated On National Stage|2440|7zqqp9|TheOnion|https://politics.theonion.com/marco-rubio-still-rock-hard-days-after-being-publicly-h-1823273762|39||1519443107.0|1
994|Mother Feels A Little Validated After Daughter Who Stayed Out Late Gets Murdered|2422|ad5ly2|TheOnion|https://local.theonion.com/mother-feels-a-little-validated-after-daughter-who-stay-1830473852?utm_content=Main&utm_source=Twitter&utm_campaign=SF&utm_medium=SocialMarketing|23||1546810445.0|1
