|title|score|id|subreddit|url|num_comments|body|created|Onion?
1410|Wealthy Teen Nearly Experiences Consequence|837|9jsdj7|TheOnion|https://www.theonion.com/wealthy-teen-nearly-experiences-consequence-1819570166|6||1538210286.0|1
1411|We Imprison Hideo Kojima In An Interview Room Until He Breaks Down And Admits He’s Just Making Shit Up As He Goes Along|838|cumaiz|TheOnion|https://ogn.theonion.com/interview-we-imprison-hideo-kojima-in-an-interview-roo-1837506102|3||1566634578.0|1
1412|Delta Pilot Refuses To Land Until Gun Control Legislation Passed|839|810hao|TheOnion|https://www.theonion.com/delta-pilot-refuses-to-land-until-gun-control-legislati-1823407638|13||1519887483.0|1
1413|Life: Fuck It: Let’s Rank The Religions|836|6i74xi|TheOnion|http://www.clickhole.com/article/fuck-it-lets-rank-religions-6193?utm_medium=RSS&amp;utm_campaign=feeds|36||1497915055.0|1
1414|Abused 12-Year-Old Alabama Girl Doesn’t Think She Can Handle Being A Mom On Top Of Everything Else|831|bp1dby|TheOnion|https://local.theonion.com/abused-12-year-old-alabama-girl-doesn-t-think-she-can-h-1834787176|35||1557972768.0|1
1415|Mild-Mannered Reporter Suddenly Transforms Into Incredible Unemployed Man|836|ald7ry|TheOnion|https://www.theonion.com/mild-mannered-reporter-suddenly-transforms-into-incredi-1819577196?utm_content=Main&utm_source=Twitter&utm_campaign=SF&utm_medium=SocialMarketing|30||1548887532.0|1
1416|Ignorant Man Who Has Learned Nothing From History Excited About ‘Star Wars: Jedi Fallen Order’|838|c1qt12|TheOnion|https://ogn.theonion.com/ignorant-man-who-has-learned-nothing-from-history-excit-1835585566|28||1560823215.0|1
1417|Alex Jones Pleads With Sandy Hook Parents To Imagine Pain An Expensive Lawsuit Would Cause Him|832|8d0ous|TheOnion|https://www.theonion.com/alex-jones-pleads-with-sandy-hook-parents-to-imagine-pa-1825338170|26||1524033132.0|1
1418|DEA Recruits Lil Wayne To Use Up All Drugs In Mexico|828|d0aapw|TheOnion|https://www.youtube.com/watch?v=F9QisdRPwEM|18||1567764173.0|1
1419|Pussy-Hat-Wearing Jeff Flake Spotted Protesting Outside Senate Ahead Of Voting Yes For Kavanaugh|828|9lyrd4|TheOnion|https://politics.theonion.com/pussy-hat-wearing-jeff-flake-spotted-protesting-outside-1829556837|16||1538882975.0|1
1420|Police Say School Shooter Had History Of School Shootings|830|bvk19c|TheOnion|https://www.youtube.com/watch?v=ZGEkOR-LGyE|7||1559418876.0|1
1421|After Much Thought, OGN Has Decided To Update Our Review Of ‘Banjo-Kazooie’ From A 9.7 To A 9.6|823|csifi8|TheOnion|https://ogn.theonion.com/after-much-thought-ogn-has-decided-to-update-our-revie-1837369382|16||1566256521.0|1
1422|Card-Only Business Discriminates Against Customers Who Just Have Milking Goats To Barter With|823|ckq7q2|TheOnion|https://www.theonion.com/card-only-business-discriminates-against-customers-who-1836882955|6||1564703793.0|1
1423|Family Comforted By Thought That Man’s Death Will Prevent Others From Climbing War Memorial To Pretend To Fuck Horse|825|cbuzrf|TheOnion|https://local.theonion.com/family-comforted-by-thought-that-man-s-death-will-preve-1819580061|8||1562875789.0|1
1424|‘You Are Donald Trump, 45th President Of The United States,’ Trump Reads From Faded Tattoo On Wrist|827|8b7z74|TheOnion|https://politics.theonion.com/you-are-donald-trump-45th-president-of-the-united-sta-1825142444|35||1523399482.0|1
1425|Silent Hero: This Dog Has No Idea It Is Single-Handedly Supporting Nearly Every Conversation At This Party|823|9ld2ih|TheOnion|https://www.clickhole.com/silent-hero-this-dog-has-no-idea-it-is-single-handedly-1829134981|3||1538696843.0|1
1426|Nation’s 30-Year-Olds Pool Money To Buy 2-Bedroom Bungalow Together|822|d1d8p2|TheOnion|https://www.theonion.com/nation-s-30-year-olds-pool-money-to-buy-2-bedroom-bunga-1837932644|5||1567989364.0|1
1427|Bus Rider Acting Like Fight Not Happening 4 Feet Away|820|a654fp|TheOnion|https://local.theonion.com/bus-rider-acting-like-fight-not-happening-4-feet-away-1819576460?utm_medium=SocialMarketing&utm_source=Twitter&utm_content=Main&utm_campaign=SF&__twitter_impression=true|9||1544825381.0|1
1428|Badass Surgeon Puts On Fingerless Latex Gloves Before Operating|819|575d1i|TheOnion|http://www.theonion.com/graphic/badass-surgeon-puts-fingerless-latex-gloves-operat-54160|1||1476322619.0|1
1429|Fox News Debuts Premium Channel For 24-Hour Coverage Of Alexandria Ocasio-Cortez|817|agpkty|TheOnion|https://www.theonion.com/fox-news-debuts-premium-channel-for-24-hour-coverage-of-1831814505|34||1547700322.0|1
1430|New Honda Commercial Openly Says Your Kids Will Die In A Car Crash If You Buy A Different Brand|812|8ayyx2|TheOnion|https://www.theonion.com/new-honda-commercial-openly-says-your-kids-will-die-in-1825104730|13||1523314112.0|1
1431|Man Finally Able To Forgive Self For Terrible Mistake He Made 2 Seconds Ago|814|a7j269|TheOnion|https://local.theonion.com/man-finally-able-to-forgive-self-for-terrible-mistake-h-1831165372?utm_content=Main&utm_medium=SocialMarketing&utm_source=Twitter&utm_campaign=SF|16||1545222582.0|1
1432|Life: Heartwarming: After This Teen Died From Cancer, The Rock Stepped Up And Took The Blame For All The Pornography Found On His Computer|815|6mfnvq|TheOnion|http://www.clickhole.com/article/heartwarming-after-teen-died-cancer-rock-stepped-a-6230?utm_medium=RSS&amp;utm_campaign=feeds|7||1499733992.0|1
1433|High School Suspends Hunky Student For Wearing Shirt|813|9na3l5|TheOnion|https://local.theonion.com/high-school-suspends-hunky-student-for-wearing-shirt-1819576511?utm_content=Main&utm_campaign=SF&utm_source=Twitter&utm_medium=SocialMarketing|14||1539294371.0|1
1434|Pompeo To Increase Bombing In Afghanistan After Figuring They’ll Miss And Hit Iran At Some Point|816|d6tjc6|TheOnion|https://politics.theonion.com/pompeo-to-increase-bombing-in-afghanistan-after-figurin-1838255613|6||1569007764.0|1
1435|That Was Fast: Roger Stone Has Already Had A Religious Awakening And Converted To Islam In Prison|817|ajuv52|TheOnion|https://www.clickhole.com/that-was-fast-roger-stone-has-already-had-a-religious-1832062978|8||1548486069.0|1
1436|Trump Boys Raid Sister’s Closet For Sexy Clothes They Can Use To Seduce And Blackmail Robert Mueller|817|a35xom|TheOnion|https://politics.theonion.com/trump-boys-raid-sister-s-closet-for-sexy-clothes-they-c-1830861715|3||1543992913.0|1
1437|Trump Forced To Take On Second Job As CVS Cashier In Order To Pay Down Business Debts|804|bmo0g5|TheOnion|https://politics.theonion.com/trump-forced-to-take-on-second-job-as-cvs-cashier-in-or-1834649644|16||1557458656.0|1
1438|Experts Praise Upcoming ‘Sonic’ Movie For Accurate Depiction Of Hedgehogs|802|bj87k2|TheOnion|https://entertainment.theonion.com/experts-praise-upcoming-sonic-movie-for-accurate-depi-1834426041|4||1556685093.0|1
1439|News: Taking A Stand: Congress Has Passed A Bill Making It Illegal To Sell Firearms To The Las Vegas Shooter|807|742zlf|TheOnion|http://www.clickhole.com/article/taking-stand-congress-has-passed-bill-making-it-il-6775?utm_medium=RSS&amp;utm_campaign=feeds|26||1507089747.0|1
1440|Viewer Prepared To Believe Whatever Documentary Tells Him About Coral Reefs|801|9qy00k|TheOnion|https://www.theonion.com/viewer-prepared-to-believe-whatever-documentary-tells-h-1819577703?utm_campaign=SF&utm_source=Twitter&utm_medium=SocialMarketing&utm_content=Main|11||1540401211.0|1
1441|All Of Nation's Living Presidents Gather To Lie About Bush Presidency|800|d2sv95|TheOnion|https://www.youtube.com/watch?v=Y7C7miv88D0|7||1568248265.0|1
1442|Four Homeless People Dead In What Girlfriend Refers To As 'Cuddle Weather'|802|7p9ttr|TheOnion|https://local.theonion.com/four-homeless-people-dead-in-what-girlfriend-refers-to-1819574385?utm_content=Main&utm_campaign=SF&utm_source=Facebook&utm_medium=SocialMarketing|8||1515557274.0|1
1443|Man Struggling To Pierce Orange Peel With Fingernail Under Impression He Could Kill If He Had To|802|5vbexp|TheOnion|http://www.theonion.com/article/man-struggling-pierce-orange-peel-fingernail-under-55329?utm_medium=RSS&utm_campaign=feeds|20||1487711768.0|1
1444|Teacher Frustrated No One In Beginner Yoga Class Can Focus Chakras Into Energy Blast|796|7g630m|TheOnion|https://local.theonion.com/teacher-frustrated-no-one-in-beginner-yoga-class-can-fo-1820796504|2||1511921288.0|1
1445|Damn: The Kid From ‘Smart House’ Got Hot But Now He’s Not Hot Again, You Just Missed The Window|802|cgsq3f|TheOnion|https://www.clickhole.com/damn-the-kid-from-smart-house-got-hot-but-now-he-s-n-1835874905|12||1563917916.0|1
1446|Recruiter Saw Your Background In Computer Science And Thought Maybe You’d Be Interested In Working Part-Time At A Kohl’s In Sioux City|795|a2hvwo|TheOnion|https://local.theonion.com/recruiter-saw-your-background-in-computer-science-and-t-1830772882|7||1543817202.0|1
1447|Study: ‘Hangin’ In There’ Best One Can Now Feel|796|bipigy|TheOnion|https://www.theonion.com/study-hangin-in-there-best-one-can-now-feel-1819579803?utm_campaign=SF&utm_content=Main&utm_source=Twitter&utm_medium=SocialMarketing|18||1556573472.0|1
1448|Guards Gun Down Four Angels Escaping From Heaven|800|bh8kx9|TheOnion|https://www.theonion.com/guards-gun-down-four-angels-escaping-from-heaven-1819577382?utm_source=Twitter&utm_campaign=SF&utm_medium=SocialMarketing&utm_content=Main|12||1556227404.0|1
1449|Being A Senator Means Making Tough Decisions That Aren't Always Popular, Smart, Politically Viable, Or Beneficial To Your Constituents|791|72s0xh|TheOnion|http://www.theonion.com/blogpost/being-senator-means-making-tough-decisions-arent-a-57040|6||1506545359.0|1
1450|Wealthy Teen Nearly Experiences Consequence|796|4mv62u|TheOnion|http://www.theonion.com/article/wealthy-teen-nearly-experiences-consequence-2551|22||1465274674.0|1
1451|Good Call: The Makers Of Cap’n Crunch Have Announced That If The Cap’n Ever Lapses Into A Coma They Would Take Him Off Life Support Immediately|795|bm41xy|TheOnion|https://www.clickhole.com/good-call-the-makers-of-cap-n-crunch-have-announced-th-1833552043|11||1557343510.0|1
1452|Desperate For Info: Nabisco Is Offering $25,000 To Anyone Who Can Tell Them Who The Hell Came Up With The Idea For Fig Newtons|791|bdi7pg|TheOnion|https://news.clickhole.com/desperate-for-info-nabisco-is-offering-25-000-to-anyo-1833847536|10||1555375287.0|1
1453|E3 Organizers Cancel Convention After Discovering Immersive Power Of Literature|787|bzdxx6|TheOnion|https://ogn.theonion.com/e3-organizers-cancel-convention-after-discovering-immer-1826771462|1||1560295929.0|1
1454|Report: Americans Most Physically Active When Getting Comfy|790|9ggbsi|TheOnion|https://www.theonion.com/report-americans-most-physically-active-when-getting-c-1819579560|7||1537178552.0|1
1455|Relationship Experts Recommend Telling Woman You Would Die For Her At Outset Of First Date|794|9bv6ns|TheOnion|https://www.theonion.com/relationship-experts-recommend-telling-woman-you-would-1828742671|15||1535762471.0|1
1456|Environmental Win! The San Diego Zoo Has Announced They Have Acquired A Big Stupid Gorilla That Loves To Eat Plastic And Styrofoam|795|bu1rkr|TheOnion|https://www.clickhole.com/environmental-win-the-san-diego-zoo-has-announced-they-1834748765|12||1559088127.0|1
1457|Budweiser Unveils Social Anxiety Bottle With 900% More Label To Pick At|789|7sdo8c|TheOnion|https://www.theonion.com/budweiser-unveils-social-anxiety-bottle-with-900-more-1819592311|5||1516734272.0|1
1458|God Completely Fucked Up After Huffing Gaseous Planet|786|ampvix|TheOnion|https://www.theonion.com/god-completely-fucked-up-after-huffing-gaseous-planet-1819579881|3||1549232004.0|1
1459|'No Way To Prevent This,' Says Only Nation Where This Regularly Happens|792|7xmhiz|TheOnion|https://www.theonion.com/no-way-to-prevent-this-says-only-nation-where-this-r-1823016659|151||1518681347.0|1
1460|Successful U.S. Airstrike Kills 30 Iraqis Who May As Well Have Been Terrorists|785|7ehxto|TheOnion|https://www.theonion.com/successful-u-s-airstrike-kills-30-iraqis-who-may-as-we-1820636516|10||1511300920.0|1
1461|Paramount Executive Snaps Up Script That Begins With Studio Logo Fading Into Establishing Shot Of Actual Mountain|790|b9szn0|TheOnion|https://entertainment.theonion.com/paramount-executive-snaps-up-script-that-begins-with-st-1833838159|3||1554508874.0|1
1462|Public Health Win: Coca-Cola Is Releasing A New Line Of Sprite That Turns Blue If Anyone Shits In The Sprite|787|970obu|TheOnion|https://www.clickhole.com/public-health-win-coca-cola-is-releasing-a-new-line-of-1828263729|10||1534212715.0|1
1463|Mike Pence Condemns Female Senators For Wantonly Sharing Senate Floor With Male Colleagues After Dark|780|7wfebj|TheOnion|https://politics.theonion.com/mike-pence-condemns-female-senators-for-wantonly-sharin-1822873862?utm_content=Main|13||1518229026.0|1
1464|Man Looks On Helplessly As Variants Of His Nickname Evolve And Multiply At Breakneck Speed|786|akz99c|TheOnion|https://local.theonion.com/man-looks-on-helplessly-as-variants-of-his-nickname-evo-1819579484?utm_content=Main&utm_campaign=SF&utm_source=Twitter&utm_medium=SocialMarketing|1||1548791370.0|1
1465|Congress Cuts Funding For 26-Year-Old Stepson|780|a6zyvg|TheOnion|https://politics.theonion.com/congress-cuts-funding-for-26-year-old-stepson-1819572544?utm_medium=SocialMarketing&utm_source=Twitter&utm_content=Main&utm_campaign=SF&__twitter_impression=true|10||1545083432.0|1
1466|Biden Complains Moderators Keep Giving Him Ample Time To Speak|776|d3j6yx|TheOnion|https://politics.theonion.com/biden-complains-moderators-keep-giving-him-ample-time-t-1838083302|16||1568373591.0|1
1467|Mom’s Christmas Stocking Noticeably Less Full|779|a9f97q|TheOnion|https://local.theonion.com/mom-s-christmas-stocking-noticeably-less-full-1831266697|8||1545777151.0|1
1468|Matt Damon Loses $500 To Guy Who Promised Professional-Looking Headshots|782|a6p34w|TheOnion|https://www.theonion.com/matt-damon-loses-500-to-guy-who-promised-professional-1819578067?utm_source=Twitter&utm_content=Main&utm_campaign=SF&utm_medium=SocialMarketing|11||1544996618.0|1
1469|Trump Solemnly Lays Wreath At Site Where He Would Have Died During Vietnam War If He Weren’t Rich|771|avma09|TheOnion|https://politics.theonion.com/trump-solemnly-lays-wreath-at-site-where-he-would-have-1832907992|13||1551353105.0|1
1470|God Excited About First Trip To Japan|777|9obnft|TheOnion|https://www.theonion.com/god-excited-about-first-trip-to-japan-1819580084?utm_content=Main&utm_medium=SocialMarketing&utm_campaign=SF&utm_source=Twitter|22||1539629956.0|1
1471|Bill Cosby Feeling Disoriented After Jury Slips Conviction Into His Verdict|773|8f5it7|TheOnion|https://www.theonion.com/bill-cosby-feeling-disoriented-after-jury-slips-convict-1825576820|1||1524800516.0|1
1472|Middle-Aged Man In Gym Locker Room Puts Shirt On Before Underwear|777|9mokrs|TheOnion|https://local.theonion.com/middle-aged-man-in-gym-locker-room-puts-shirt-on-before-1819578588?utm_content=Main&utm_campaign=SF&utm_medium=SocialMarketing&utm_source=Twitter&__twitter_impression=true&__twitter_impression=true&__twitter_impression=true|9||1539115740.0|1
1473|Life: Probably Bullshit But Still A Little Scary: Ethan Is Claiming That His Super Soaker Is Filled With Pee|772|7us936|TheOnion|http://www.clickhole.com/article/probably-bullshit-still-little-scary-ethan-claimin-7296?utm_medium=RSS&amp;utm_campaign=feeds|7||1517616060.0|1
1474|So Kind: When This Group Of Middle School Boys Saw An Old Man Sitting Alone At A Restaurant, They Generously Informed Him Of All The Things He Be Lookin’ Like|767|bjx66j|TheOnion|https://www.clickhole.com/so-kind-when-this-group-of-middle-school-boys-saw-an-o-1834079608|3||1556844417.0|1
1475|Pope Promises More Open, Transparent Molestation In Future|768|9b2rf4|TheOnion|https://www.theonion.com/pope-promises-more-open-transparent-molestation-in-fut-1828663069|12||1535518865.0|1
1476|Report: 79% Of World’s Attics Remain Unexplored|770|b7ac2t|TheOnion|https://www.theonion.com/report-79-of-world-s-attics-remain-unexplored-1819577115?utm_campaign=SF&utm_content=Main&utm_source=Twitter&utm_medium=SocialMarketing|6||1553974926.0|1
1477|Dick Cheney Finally Hunts Down, Kills Man He Shot In Face In 2006|770|al4wff|TheOnion|https://politics.theonion.com/dick-cheney-finally-hunts-down-kills-man-he-shot-in-fa-1832167962|9||1548825670.0|1
1478|Report: Average American Spends 25% Of Life Waiting In Line At Cell Phone Store|771|9vtvgc|TheOnion|https://www.theonion.com/report-average-american-spends-25-of-life-waiting-in-1830071838|9||1541881181.0|1
1479|Clearing Things Up: KISS Has Announced That All Of Their Sex Songs Are About Having Sex With Human Women Even Though They’re Dressed Up As Demons And Aliens And A Cat|761|cgfeq4|TheOnion|https://www.clickhole.com/clearing-things-up-kiss-has-announced-that-all-of-thei-1836215888|3||1563841733.0|1
1480|U.S. Government Stages Fake Coup To Wipe Out National Debt|762|d4mryq|TheOnion|https://www.youtube.com/watch?v=TRgRz3nSG7o&feature=share|16||1568593928.0|1
1481|Area Man Has Naked-Lady Fetish|757|cafx8h|TheOnion|https://www.theonion.com/area-man-has-naked-lady-fetish-1819564926|29||1562585355.0|1
1482|Majority Of Americans Voice Support For Bernie Sanders After Learning He’s A Millionaire|762|bbs3oa|TheOnion|https://politics.theonion.com/majority-of-americans-voice-support-for-bernie-sanders-1833954045|10||1554962862.0|1
1483|Taylor Swift Grateful Kanye West Controversy Taking Heat Off New Swastika Tattoo|758|8exwud|TheOnion|https://entertainment.theonion.com/taylor-swift-grateful-kanye-west-controversy-taking-hea-1825548458|29||1524725729.0|1
1484|Omarosa Searches Through Tapes Of Everyone Else In White House Using N-Word For One Of Trump|753|97dl2h|TheOnion|https://politics.theonion.com/omarosa-searches-through-tapes-of-everyone-else-in-whit-1828344800|19||1534320429.0|1
1485|Paul Ryan Slits Auto Mechanic’s Throat To Kick Off GOP Purge Of Working Class|756|7l464s|TheOnion|https://politics.theonion.com/paul-ryan-slits-auto-mechanic-s-throat-to-kick-off-gop-1821475569|15||1513830681.0|1
1486|News: Life After The White House: Obama Just Launched His First Drone Strike As A Civilian|757|68u2bc|TheOnion|http://www.clickhole.com/article/life-after-white-house-obama-just-launched-his-fir-5996?utm_medium=RSS&amp;utm_campaign=feeds|22||1493770260.0|1
1487|Bolton Argues War With Iran Only Way To Avenge Americans Killed In Upcoming War With Iran|747|ci4cym|TheOnion|https://www.theonion.com/bolton-argues-war-with-iran-only-way-to-avenge-american-1835704580|9||1564184060.0|1
1488|The Master At Her Canvas: Mom Just Brought In A Pretty Average-Looking Rock From The Woods That She Says She Will Use In A ‘Project’|748|cet6zi|TheOnion|https://news.clickhole.com/the-master-at-her-canvas-mom-just-brought-in-a-pretty-1836210045|3||1563488907.0|1
1489|Papa John’s Removes N-Word From Menus|749|abzfpm|TheOnion|https://www.theonion.com/papa-john-s-removes-n-word-from-menus-1827552298|19||1546502139.0|1
1490|Lincoln Memorial Empty After Former President’s Statue Furloughed|750|agmf2n|TheOnion|https://politics.theonion.com/lincoln-memorial-empty-after-former-president-s-statue-1831802254|6||1547682506.0|1
1491|Man’s Family Rises To Record-High Fourth Priority|749|a0j1bw|TheOnion|https://local.theonion.com/man-s-family-rises-to-record-high-fourth-priority-1819577274?utm_campaign=SF&utm_content=Main&utm_source=Twitter&utm_medium=SocialMarketing|8||1543265180.0|1
1492|Heartbreaking: The Thing You Want Is All The Way Over There|750|9itcsk|TheOnion|https://www.clickhole.com/heartbreaking-the-thing-you-want-is-all-the-way-over-t-1828987073|2||1537919773.0|1
1493|Roadmap To Peace: Necco Has Set Aside A Roll Of Wafers For Israel And Palestine To Share Only After They Achieve A Two-State Solution|744|8trav1|TheOnion|https://www.clickhole.com/roadmap-to-peace-necco-has-set-aside-a-roll-of-wafers-1826271693|18||1529968489.0|1
1494|This Amazing New Product Called ‘Monocle Glue’ Ensures Your Monocle Won’t Go Flying Off Your Face When Your Daughter Tells You She’s Marrying A Commoner|740|8k54zm|TheOnion|https://www.clickhole.com/this-amazing-new-product-called-monocle-glue-ensures-1825713016|9||1526599893.0|1
1495|‘I’ll Make Those Bastards Pay,’ Teary-Eyed Mueller Whispers Into Locket Containing Photo Of James Comey|747|79qo3s|TheOnion|https://politics.theonion.com/i-ll-make-those-bastards-pay-teary-eyed-mueller-whis-1819984107|1||1509425758.0|1
1496|Dad Can’t Believe Lawn Didn’t Get Him Anything For Father’s Day|743|c1g1ep|TheOnion|https://local.theonion.com/dad-can-t-believe-lawn-didn-t-get-him-anything-for-fath-1819575133|9||1560753973.0|1
1497|Desperate Catholic Church Now Offering Sainthood To Anyone Who Regularly Attends Weekly Mass|743|bg0l2d|TheOnion|https://www.theonion.com/desperate-catholic-church-now-offering-sainthood-to-any-1819576218?utm_content=Main&utm_medium=SocialMarketing&utm_campaign=SF&utm_source=Twitter|17||1555958490.0|1
1498|Americans Observing 911 By Trying Not To Masturbate|743|9ew2hp|TheOnion|https://www.youtube.com/watch?v=dRoVFK2XkN0|13||1536687681.0|1
1499|Fallen Firefighter Remembered As Idiot Who Sucked At His Job|738|9w15k2|TheOnion|https://local.theonion.com/fallen-firefighter-remembered-as-idiot-who-sucked-at-hi-1819574741?utm_source=Twitter&utm_content=Main&utm_campaign=SF&utm_medium=SocialMarketing&__twitter_impression=true&__twitter_impression=true|15||1541940621.0|1
1500|Florida To Experiment With New 600-Lever Voting Machine|734|9rjbaw|TheOnion|https://www.youtube.com/watch?v=MmPtfy9P714|9||1540575944.0|1
1501|Modern-Day Caligula Orders Everything Bagel|734|ax7nwq|TheOnion|https://www.theonion.com/modern-day-caligula-orders-everything-bagel-1819575950?utm_content=Main&utm_source=Twitter&utm_medium=SocialMarketing&utm_campaign=SF|11||1551738221.0|1
1502|Brave Mountain Lion Fends Off Group Of Hikers|736|b8hp42|TheOnion|https://www.theonion.com/brave-mountain-lion-fends-off-group-of-hikers-1819570094?utm_content=Main&utm_source=Twitter&utm_campaign=SF&utm_medium=SocialMarketing|5||1554231399.0|1
1503|Small Town Throws Pride Parade For Only Gay Resident|729|bt0nca|TheOnion|https://youtu.be/QckK4WzKGOk|21||1558852960.0|1
1504|Old Man With Foggy Eye Not Even Magical|723|854hq0|TheOnion|https://local.theonion.com/old-man-with-foggy-eye-not-even-magical-1823386160|1||1521330047.0|1
1505|Man Gains New Disdain For Band After Seeing Them Live|724|cl4sk4|TheOnion|https://local.theonion.com/man-gains-new-disdain-for-band-after-seeing-them-live-1836907932|29||1564784685.0|1
1506|Trump Slams Worldwide Jewish Conspiracy For Not Doing More To Prevent Synagogue Shooting|725|9twbzh|TheOnion|https://politics.theonion.com/trump-slams-worldwide-jewish-conspiracy-for-not-doing-m-1830077401?utm_medium=SocialMarketing&utm_content=Main&utm_source=Twitter&utm_campaign=SF|14||1541297727.0|1
1507|Probably Bullshit But Still A Little Scary: Ethan Is Claiming That His Super Soaker Is Filled With Pee|723|7vgxnx|TheOnion|http://www.clickhole.com/article/probably-bullshit-still-little-scary-ethan-claimin-7296|14||1517885322.0|1
1508|Light Beer Healthiest Food Option At Stadium|723|be95zx|TheOnion|https://sports.theonion.com/light-beer-healthiest-food-option-at-stadium-1834109771|11||1555543863.0|1
1509|Concentric Circles Emanating From Glowing Red Dot|725|8wa46q|TheOnion|https://www.youtube.com/watch?v=8wHMaJ6AtNs|6||1530823177.0|1
1510|Congress Approves $540 Million For Evil|725|8p7xvu|TheOnion|https://politics.theonion.com/congress-approves-540-million-for-evil-1819564550|18||1528380491.0|1
1511|Unambitious Loser With Happy, Fulfilling Life Still Lives In Hometown|728|82fu58|TheOnion|https://local.theonion.com/unambitious-loser-with-happy-fulfilling-life-still-liv-1819575312|10||1520378603.0|1
1512|Sullen Jeff Sessions Scrolls Through Minority Incarceration Statistics To Cheer Self Up|725|6pwose|TheOnion|http://www.theonion.com/article/sullen-jeff-sessions-scrolls-through-minority-inca-56496|20||1501198239.0|1
1513|First Automated Foxconn Machine Immediately Tries To Commit Suicide|725|alukbw|TheOnion|https://www.theonion.com/first-automated-foxconn-machine-immediately-tries-to-co-1832242264|8||1548999469.0|1
1514|Michael Phelps Returns To His Tank At Sea World|719|4xqcj4|TheOnion|http://www.theonion.com/article/michael-phelps-returns-to-his-tank-at-sea-world-2515|2||1471241158.0|1
1515|Study Finds Not Acting Like Total Fucking Moron Most Attractive Quality In Potential Mate|718|bwt774|TheOnion|https://www.theonion.com/study-finds-not-acting-like-total-fucking-moron-most-at-1819579960|13||1559706769.0|1
1516|Fed Up: Steve Harvey Is Leaving ‘Family Feud’ After Yet Another Season Went By Without Somebody Noticing That He Got All Dressed Up|720|8pbfuh|TheOnion|https://www.clickhole.com/fed-up-steve-harvey-is-leaving-family-feud-after-yet-1825999643|16||1528415795.0|1
1517|New Poll Finds 80% Of Americans Would Just Fucking Destroy A Pan Of Brownies|716|4wda7y|TheOnion|http://www.theonion.com/article/new-poll-finds-80-americans-would-just-fucking-des-53462|16||1470468236.0|1
1518|Jay-Z Vows Not To Lose Touch With Millionaire Roots On Gritty Throwback Track About Buying First Yacht|715|bwg2fu|TheOnion|https://entertainment.theonion.com/jay-z-vows-not-to-lose-touch-with-millionaire-roots-on-1835214290|0||1559624983.0|1
1519|Spectacular News! Dad Finished The Book That’s Been On His Bedside Table For 23 Years|716|bbmf5y|TheOnion|https://www.clickhole.com/spectacular-news-dad-finished-the-book-that-s-been-on-1833849750|10||1554933947.0|1
1520|Nation Demands New Photograph Of Edward Snowden|710|b3og41|TheOnion|https://youtu.be/k5H_b3mVz8s|9||1553189245.0|1
1521|News: We Get It, You’re An Ally: Matt Damon Went Totally Overboard At The Oscars When He Ran On Stage Holding Harvey Weinstein’s Severed Penis To Support The #MeToo Movement|709|823an0|TheOnion|http://www.clickhole.com/article/we-get-it-youre-ally-matt-damon-went-totally-overb-7292?utm_medium=RSS&amp;utm_campaign=feeds|9||1520252055.0|1
