|title|score|id|subreddit|url|num_comments|body|created|Onion?
1408|14-Hour Labor Not Exactly Cakewalk For Baby Sticking Halfway Out Mother’s Vagina Either|849|9rbqhq|TheOnion|https://local.theonion.com/14-hour-labor-not-exactly-cakewalk-for-baby-sticking-ha-1829996708|5||1540512934.0|1
1409|Ethical Hunter Throws Duck He Shot Back Into Sky|849|9ixgi0|TheOnion|https://www.theonion.com/ethical-hunter-throws-duck-he-shot-back-into-sky-1819578245?utm_content=Main&utm_source=Twitter&utm_medium=SocialMarketing&utm_campaign=SF|4||1537948828.0|1
1410|‘The Onion’ Endorses Legal Marijuana|851|bfbus7|TheOnion|https://www.theonion.com/the-onion-endorses-legal-marijuana-1834080638|10||1555793419.0|1
1411|Mother's Little Angel Just Made Fun Of Classmate's Weight For 30 Straight Minutes|845|9oo93u|TheOnion|https://local.theonion.com/mothers-little-angel-just-made-fun-of-classmates-weight-1819573082?utm_source=Twitter&utm_campaign=SF&utm_medium=SocialMarketing&utm_content=Main|6||1539729822.0|1
1412|Fun Toy Banned Because Of Three Stupid Dead Kids|845|apo12y|TheOnion|https://www.theonion.com/fun-toy-banned-because-of-three-stupid-dead-kids-1819565691|9||1549965836.0|1
1413|Film Character Moves Into Beautiful Brooklyn Brownstone After Getting Dream Publishing Job|839|ahbg6l|TheOnion|https://entertainment.theonion.com/film-character-moves-into-beautiful-brooklyn-brownstone-1819574576?utm_medium=SocialMarketing&utm_content=Main&utm_campaign=SF&utm_source=Twitter|20||1547853492.0|1
1414|Wealthy Teen Nearly Experiences Consequence|838|9jsdj7|TheOnion|https://www.theonion.com/wealthy-teen-nearly-experiences-consequence-1819570166|6||1538210286.0|1
1415|We Imprison Hideo Kojima In An Interview Room Until He Breaks Down And Admits He’s Just Making Shit Up As He Goes Along|843|cumaiz|TheOnion|https://ogn.theonion.com/interview-we-imprison-hideo-kojima-in-an-interview-roo-1837506102|3||1566634578.0|1
1416|Delta Pilot Refuses To Land Until Gun Control Legislation Passed|838|810hao|TheOnion|https://www.theonion.com/delta-pilot-refuses-to-land-until-gun-control-legislati-1823407638|13||1519887483.0|1
1417|Life: Fuck It: Let’s Rank The Religions|837|6i74xi|TheOnion|http://www.clickhole.com/article/fuck-it-lets-rank-religions-6193?utm_medium=RSS&amp;utm_campaign=feeds|36||1497915055.0|1
1418|Abused 12-Year-Old Alabama Girl Doesn’t Think She Can Handle Being A Mom On Top Of Everything Else|831|bp1dby|TheOnion|https://local.theonion.com/abused-12-year-old-alabama-girl-doesn-t-think-she-can-h-1834787176|35||1557972768.0|1
1419|Mild-Mannered Reporter Suddenly Transforms Into Incredible Unemployed Man|834|ald7ry|TheOnion|https://www.theonion.com/mild-mannered-reporter-suddenly-transforms-into-incredi-1819577196?utm_content=Main&utm_source=Twitter&utm_campaign=SF&utm_medium=SocialMarketing|30||1548887532.0|1
1420|Ignorant Man Who Has Learned Nothing From History Excited About ‘Star Wars: Jedi Fallen Order’|837|c1qt12|TheOnion|https://ogn.theonion.com/ignorant-man-who-has-learned-nothing-from-history-excit-1835585566|28||1560823215.0|1
1421|Alex Jones Pleads With Sandy Hook Parents To Imagine Pain An Expensive Lawsuit Would Cause Him|837|8d0ous|TheOnion|https://www.theonion.com/alex-jones-pleads-with-sandy-hook-parents-to-imagine-pa-1825338170|26||1524033132.0|1
1422|DEA Recruits Lil Wayne To Use Up All Drugs In Mexico|831|d0aapw|TheOnion|https://www.youtube.com/watch?v=F9QisdRPwEM|18||1567764173.0|1
1423|Pussy-Hat-Wearing Jeff Flake Spotted Protesting Outside Senate Ahead Of Voting Yes For Kavanaugh|823|9lyrd4|TheOnion|https://politics.theonion.com/pussy-hat-wearing-jeff-flake-spotted-protesting-outside-1829556837|16||1538882975.0|1
1424|Police Say School Shooter Had History Of School Shootings|827|bvk19c|TheOnion|https://www.youtube.com/watch?v=ZGEkOR-LGyE|7||1559418876.0|1
1425|After Much Thought, OGN Has Decided To Update Our Review Of ‘Banjo-Kazooie’ From A 9.7 To A 9.6|827|csifi8|TheOnion|https://ogn.theonion.com/after-much-thought-ogn-has-decided-to-update-our-revie-1837369382|16||1566256521.0|1
1426|Card-Only Business Discriminates Against Customers Who Just Have Milking Goats To Barter With|827|ckq7q2|TheOnion|https://www.theonion.com/card-only-business-discriminates-against-customers-who-1836882955|6||1564703793.0|1
1427|Family Comforted By Thought That Man’s Death Will Prevent Others From Climbing War Memorial To Pretend To Fuck Horse|826|cbuzrf|TheOnion|https://local.theonion.com/family-comforted-by-thought-that-man-s-death-will-preve-1819580061|8||1562875789.0|1
1428|‘You Are Donald Trump, 45th President Of The United States,’ Trump Reads From Faded Tattoo On Wrist|824|8b7z74|TheOnion|https://politics.theonion.com/you-are-donald-trump-45th-president-of-the-united-sta-1825142444|35||1523399482.0|1
1429|Silent Hero: This Dog Has No Idea It Is Single-Handedly Supporting Nearly Every Conversation At This Party|818|9ld2ih|TheOnion|https://www.clickhole.com/silent-hero-this-dog-has-no-idea-it-is-single-handedly-1829134981|3||1538696843.0|1
1430|Nation’s 30-Year-Olds Pool Money To Buy 2-Bedroom Bungalow Together|821|d1d8p2|TheOnion|https://www.theonion.com/nation-s-30-year-olds-pool-money-to-buy-2-bedroom-bunga-1837932644|5||1567989364.0|1
1431|Bus Rider Acting Like Fight Not Happening 4 Feet Away|819|a654fp|TheOnion|https://local.theonion.com/bus-rider-acting-like-fight-not-happening-4-feet-away-1819576460?utm_medium=SocialMarketing&utm_source=Twitter&utm_content=Main&utm_campaign=SF&__twitter_impression=true|9||1544825381.0|1
1432|Badass Surgeon Puts On Fingerless Latex Gloves Before Operating|821|575d1i|TheOnion|http://www.theonion.com/graphic/badass-surgeon-puts-fingerless-latex-gloves-operat-54160|1||1476322619.0|1
1433|Fox News Debuts Premium Channel For 24-Hour Coverage Of Alexandria Ocasio-Cortez|816|agpkty|TheOnion|https://www.theonion.com/fox-news-debuts-premium-channel-for-24-hour-coverage-of-1831814505|34||1547700322.0|1
1434|New Honda Commercial Openly Says Your Kids Will Die In A Car Crash If You Buy A Different Brand|821|8ayyx2|TheOnion|https://www.theonion.com/new-honda-commercial-openly-says-your-kids-will-die-in-1825104730|13||1523314112.0|1
1435|Man Finally Able To Forgive Self For Terrible Mistake He Made 2 Seconds Ago|816|a7j269|TheOnion|https://local.theonion.com/man-finally-able-to-forgive-self-for-terrible-mistake-h-1831165372?utm_content=Main&utm_medium=SocialMarketing&utm_source=Twitter&utm_campaign=SF|16||1545222582.0|1
1436|Life: Heartwarming: After This Teen Died From Cancer, The Rock Stepped Up And Took The Blame For All The Pornography Found On His Computer|817|6mfnvq|TheOnion|http://www.clickhole.com/article/heartwarming-after-teen-died-cancer-rock-stepped-a-6230?utm_medium=RSS&amp;utm_campaign=feeds|7||1499733992.0|1
1437|Pompeo To Increase Bombing In Afghanistan After Figuring They’ll Miss And Hit Iran At Some Point|811|d6tjc6|TheOnion|https://politics.theonion.com/pompeo-to-increase-bombing-in-afghanistan-after-figurin-1838255613|6||1569007764.0|1
1438|High School Suspends Hunky Student For Wearing Shirt|811|9na3l5|TheOnion|https://local.theonion.com/high-school-suspends-hunky-student-for-wearing-shirt-1819576511?utm_content=Main&utm_campaign=SF&utm_source=Twitter&utm_medium=SocialMarketing|14||1539294371.0|1
1439|That Was Fast: Roger Stone Has Already Had A Religious Awakening And Converted To Islam In Prison|813|ajuv52|TheOnion|https://www.clickhole.com/that-was-fast-roger-stone-has-already-had-a-religious-1832062978|8||1548486069.0|1
1440|Trump Boys Raid Sister’s Closet For Sexy Clothes They Can Use To Seduce And Blackmail Robert Mueller|815|a35xom|TheOnion|https://politics.theonion.com/trump-boys-raid-sister-s-closet-for-sexy-clothes-they-c-1830861715|3||1543992913.0|1
1441|Trump Forced To Take On Second Job As CVS Cashier In Order To Pay Down Business Debts|808|bmo0g5|TheOnion|https://politics.theonion.com/trump-forced-to-take-on-second-job-as-cvs-cashier-in-or-1834649644|16||1557458656.0|1
1442|Experts Praise Upcoming ‘Sonic’ Movie For Accurate Depiction Of Hedgehogs|809|bj87k2|TheOnion|https://entertainment.theonion.com/experts-praise-upcoming-sonic-movie-for-accurate-depi-1834426041|4||1556685093.0|1
1443|News: Taking A Stand: Congress Has Passed A Bill Making It Illegal To Sell Firearms To The Las Vegas Shooter|802|742zlf|TheOnion|http://www.clickhole.com/article/taking-stand-congress-has-passed-bill-making-it-il-6775?utm_medium=RSS&amp;utm_campaign=feeds|26||1507089747.0|1
1444|Viewer Prepared To Believe Whatever Documentary Tells Him About Coral Reefs|799|9qy00k|TheOnion|https://www.theonion.com/viewer-prepared-to-believe-whatever-documentary-tells-h-1819577703?utm_campaign=SF&utm_source=Twitter&utm_medium=SocialMarketing&utm_content=Main|11||1540401211.0|1
1445|All Of Nation's Living Presidents Gather To Lie About Bush Presidency|803|d2sv95|TheOnion|https://www.youtube.com/watch?v=Y7C7miv88D0|7||1568248265.0|1
1446|Four Homeless People Dead In What Girlfriend Refers To As 'Cuddle Weather'|800|7p9ttr|TheOnion|https://local.theonion.com/four-homeless-people-dead-in-what-girlfriend-refers-to-1819574385?utm_content=Main&utm_campaign=SF&utm_source=Facebook&utm_medium=SocialMarketing|8||1515557274.0|1
1447|Man Struggling To Pierce Orange Peel With Fingernail Under Impression He Could Kill If He Had To|802|5vbexp|TheOnion|http://www.theonion.com/article/man-struggling-pierce-orange-peel-fingernail-under-55329?utm_medium=RSS&utm_campaign=feeds|20||1487711768.0|1
1448|Teacher Frustrated No One In Beginner Yoga Class Can Focus Chakras Into Energy Blast|798|7g630m|TheOnion|https://local.theonion.com/teacher-frustrated-no-one-in-beginner-yoga-class-can-fo-1820796504|2||1511921288.0|1
1449|Damn: The Kid From ‘Smart House’ Got Hot But Now He’s Not Hot Again, You Just Missed The Window|803|cgsq3f|TheOnion|https://www.clickhole.com/damn-the-kid-from-smart-house-got-hot-but-now-he-s-n-1835874905|12||1563917916.0|1
1450|Recruiter Saw Your Background In Computer Science And Thought Maybe You’d Be Interested In Working Part-Time At A Kohl’s In Sioux City|797|a2hvwo|TheOnion|https://local.theonion.com/recruiter-saw-your-background-in-computer-science-and-t-1830772882|7||1543817202.0|1
1451|Study: ‘Hangin’ In There’ Best One Can Now Feel|793|bipigy|TheOnion|https://www.theonion.com/study-hangin-in-there-best-one-can-now-feel-1819579803?utm_campaign=SF&utm_content=Main&utm_source=Twitter&utm_medium=SocialMarketing|18||1556573472.0|1
1452|Guards Gun Down Four Angels Escaping From Heaven|792|bh8kx9|TheOnion|https://www.theonion.com/guards-gun-down-four-angels-escaping-from-heaven-1819577382?utm_source=Twitter&utm_campaign=SF&utm_medium=SocialMarketing&utm_content=Main|12||1556227404.0|1
1453|Being A Senator Means Making Tough Decisions That Aren't Always Popular, Smart, Politically Viable, Or Beneficial To Your Constituents|795|72s0xh|TheOnion|http://www.theonion.com/blogpost/being-senator-means-making-tough-decisions-arent-a-57040|6||1506545359.0|1
1454|Wealthy Teen Nearly Experiences Consequence|799|4mv62u|TheOnion|http://www.theonion.com/article/wealthy-teen-nearly-experiences-consequence-2551|22||1465274674.0|1
1455|Good Call: The Makers Of Cap’n Crunch Have Announced That If The Cap’n Ever Lapses Into A Coma They Would Take Him Off Life Support Immediately|795|bm41xy|TheOnion|https://www.clickhole.com/good-call-the-makers-of-cap-n-crunch-have-announced-th-1833552043|11||1557343510.0|1
1456|Desperate For Info: Nabisco Is Offering $25,000 To Anyone Who Can Tell Them Who The Hell Came Up With The Idea For Fig Newtons|789|bdi7pg|TheOnion|https://news.clickhole.com/desperate-for-info-nabisco-is-offering-25-000-to-anyo-1833847536|10||1555375287.0|1
1457|E3 Organizers Cancel Convention After Discovering Immersive Power Of Literature|793|bzdxx6|TheOnion|https://ogn.theonion.com/e3-organizers-cancel-convention-after-discovering-immer-1826771462|1||1560295929.0|1
1458|Report: Americans Most Physically Active When Getting Comfy|789|9ggbsi|TheOnion|https://www.theonion.com/report-americans-most-physically-active-when-getting-c-1819579560|7||1537178552.0|1
1459|Relationship Experts Recommend Telling Woman You Would Die For Her At Outset Of First Date|788|9bv6ns|TheOnion|https://www.theonion.com/relationship-experts-recommend-telling-woman-you-would-1828742671|15||1535762471.0|1
1460|Environmental Win! The San Diego Zoo Has Announced They Have Acquired A Big Stupid Gorilla That Loves To Eat Plastic And Styrofoam|786|bu1rkr|TheOnion|https://www.clickhole.com/environmental-win-the-san-diego-zoo-has-announced-they-1834748765|12||1559088127.0|1
1461|Budweiser Unveils Social Anxiety Bottle With 900% More Label To Pick At|785|7sdo8c|TheOnion|https://www.theonion.com/budweiser-unveils-social-anxiety-bottle-with-900-more-1819592311|5||1516734272.0|1
1462|God Completely Fucked Up After Huffing Gaseous Planet|787|ampvix|TheOnion|https://www.theonion.com/god-completely-fucked-up-after-huffing-gaseous-planet-1819579881|3||1549232004.0|1
1463|'No Way To Prevent This,' Says Only Nation Where This Regularly Happens|789|7xmhiz|TheOnion|https://www.theonion.com/no-way-to-prevent-this-says-only-nation-where-this-r-1823016659|151||1518681347.0|1
1464|Successful U.S. Airstrike Kills 30 Iraqis Who May As Well Have Been Terrorists|784|7ehxto|TheOnion|https://www.theonion.com/successful-u-s-airstrike-kills-30-iraqis-who-may-as-we-1820636516|10||1511300920.0|1
1465|Paramount Executive Snaps Up Script That Begins With Studio Logo Fading Into Establishing Shot Of Actual Mountain|779|b9szn0|TheOnion|https://entertainment.theonion.com/paramount-executive-snaps-up-script-that-begins-with-st-1833838159|3||1554508874.0|1
1466|Public Health Win: Coca-Cola Is Releasing A New Line Of Sprite That Turns Blue If Anyone Shits In The Sprite|784|970obu|TheOnion|https://www.clickhole.com/public-health-win-coca-cola-is-releasing-a-new-line-of-1828263729|10||1534212715.0|1
1467|Nation’s Indigenous People Confirm They Don’t Need Special Holiday, Just Large Swaths Of Land Returned Immediately|785|dhubjb|TheOnion|https://www.theonion.com/nation-s-indigenous-people-confirm-they-don-t-need-spec-1839033177|15||1571104656.0|1
1468|Mike Pence Condemns Female Senators For Wantonly Sharing Senate Floor With Male Colleagues After Dark|784|7wfebj|TheOnion|https://politics.theonion.com/mike-pence-condemns-female-senators-for-wantonly-sharin-1822873862?utm_content=Main|13||1518229026.0|1
1469|Man Looks On Helplessly As Variants Of His Nickname Evolve And Multiply At Breakneck Speed|782|akz99c|TheOnion|https://local.theonion.com/man-looks-on-helplessly-as-variants-of-his-nickname-evo-1819579484?utm_content=Main&utm_campaign=SF&utm_source=Twitter&utm_medium=SocialMarketing|1||1548791370.0|1
1470|Congress Cuts Funding For 26-Year-Old Stepson|777|a6zyvg|TheOnion|https://politics.theonion.com/congress-cuts-funding-for-26-year-old-stepson-1819572544?utm_medium=SocialMarketing&utm_source=Twitter&utm_content=Main&utm_campaign=SF&__twitter_impression=true|10||1545083432.0|1
1471|Biden Complains Moderators Keep Giving Him Ample Time To Speak|775|d3j6yx|TheOnion|https://politics.theonion.com/biden-complains-moderators-keep-giving-him-ample-time-t-1838083302|16||1568373591.0|1
1472|Mom’s Christmas Stocking Noticeably Less Full|780|a9f97q|TheOnion|https://local.theonion.com/mom-s-christmas-stocking-noticeably-less-full-1831266697|8||1545777151.0|1
1473|Matt Damon Loses $500 To Guy Who Promised Professional-Looking Headshots|774|a6p34w|TheOnion|https://www.theonion.com/matt-damon-loses-500-to-guy-who-promised-professional-1819578067?utm_source=Twitter&utm_content=Main&utm_campaign=SF&utm_medium=SocialMarketing|11||1544996618.0|1
1474|Trump Solemnly Lays Wreath At Site Where He Would Have Died During Vietnam War If He Weren’t Rich|769|avma09|TheOnion|https://politics.theonion.com/trump-solemnly-lays-wreath-at-site-where-he-would-have-1832907992|13||1551353105.0|1
1475|God Excited About First Trip To Japan|772|9obnft|TheOnion|https://www.theonion.com/god-excited-about-first-trip-to-japan-1819580084?utm_content=Main&utm_medium=SocialMarketing&utm_campaign=SF&utm_source=Twitter|22||1539629956.0|1
1476|Bill Cosby Feeling Disoriented After Jury Slips Conviction Into His Verdict|773|8f5it7|TheOnion|https://www.theonion.com/bill-cosby-feeling-disoriented-after-jury-slips-convict-1825576820|1||1524800516.0|1
1477|Middle-Aged Man In Gym Locker Room Puts Shirt On Before Underwear|776|9mokrs|TheOnion|https://local.theonion.com/middle-aged-man-in-gym-locker-room-puts-shirt-on-before-1819578588?utm_content=Main&utm_campaign=SF&utm_medium=SocialMarketing&utm_source=Twitter&__twitter_impression=true&__twitter_impression=true&__twitter_impression=true|9||1539115740.0|1
1478|Life: Probably Bullshit But Still A Little Scary: Ethan Is Claiming That His Super Soaker Is Filled With Pee|773|7us936|TheOnion|http://www.clickhole.com/article/probably-bullshit-still-little-scary-ethan-claimin-7296?utm_medium=RSS&amp;utm_campaign=feeds|7||1517616060.0|1
1479|So Kind: When This Group Of Middle School Boys Saw An Old Man Sitting Alone At A Restaurant, They Generously Informed Him Of All The Things He Be Lookin’ Like|772|bjx66j|TheOnion|https://www.clickhole.com/so-kind-when-this-group-of-middle-school-boys-saw-an-o-1834079608|3||1556844417.0|1
1480|Pope Promises More Open, Transparent Molestation In Future|770|9b2rf4|TheOnion|https://www.theonion.com/pope-promises-more-open-transparent-molestation-in-fut-1828663069|12||1535518865.0|1
1481|Report: 79% Of World’s Attics Remain Unexplored|764|b7ac2t|TheOnion|https://www.theonion.com/report-79-of-world-s-attics-remain-unexplored-1819577115?utm_campaign=SF&utm_content=Main&utm_source=Twitter&utm_medium=SocialMarketing|6||1553974926.0|1
1482|Dick Cheney Finally Hunts Down, Kills Man He Shot In Face In 2006|768|al4wff|TheOnion|https://politics.theonion.com/dick-cheney-finally-hunts-down-kills-man-he-shot-in-fa-1832167962|9||1548825670.0|1
1483|Report: Average American Spends 25% Of Life Waiting In Line At Cell Phone Store|766|9vtvgc|TheOnion|https://www.theonion.com/report-average-american-spends-25-of-life-waiting-in-1830071838|9||1541881181.0|1
1484|Clearing Things Up: KISS Has Announced That All Of Their Sex Songs Are About Having Sex With Human Women Even Though They’re Dressed Up As Demons And Aliens And A Cat|762|cgfeq4|TheOnion|https://www.clickhole.com/clearing-things-up-kiss-has-announced-that-all-of-thei-1836215888|3||1563841733.0|1
1485|U.S. Government Stages Fake Coup To Wipe Out National Debt|767|d4mryq|TheOnion|https://www.youtube.com/watch?v=TRgRz3nSG7o&feature=share|16||1568593928.0|1
1486|Area Man Has Naked-Lady Fetish|762|cafx8h|TheOnion|https://www.theonion.com/area-man-has-naked-lady-fetish-1819564926|29||1562585355.0|1
1487|Majority Of Americans Voice Support For Bernie Sanders After Learning He’s A Millionaire|759|bbs3oa|TheOnion|https://politics.theonion.com/majority-of-americans-voice-support-for-bernie-sanders-1833954045|10||1554962862.0|1
1488|Taylor Swift Grateful Kanye West Controversy Taking Heat Off New Swastika Tattoo|761|8exwud|TheOnion|https://entertainment.theonion.com/taylor-swift-grateful-kanye-west-controversy-taking-hea-1825548458|29||1524725729.0|1
1489|Omarosa Searches Through Tapes Of Everyone Else In White House Using N-Word For One Of Trump|756|97dl2h|TheOnion|https://politics.theonion.com/omarosa-searches-through-tapes-of-everyone-else-in-whit-1828344800|19||1534320429.0|1
1490|Paul Ryan Slits Auto Mechanic’s Throat To Kick Off GOP Purge Of Working Class|758|7l464s|TheOnion|https://politics.theonion.com/paul-ryan-slits-auto-mechanic-s-throat-to-kick-off-gop-1821475569|15||1513830681.0|1
1491|News: Life After The White House: Obama Just Launched His First Drone Strike As A Civilian|755|68u2bc|TheOnion|http://www.clickhole.com/article/life-after-white-house-obama-just-launched-his-fir-5996?utm_medium=RSS&amp;utm_campaign=feeds|22||1493770260.0|1
1492|Bolton Argues War With Iran Only Way To Avenge Americans Killed In Upcoming War With Iran|750|ci4cym|TheOnion|https://www.theonion.com/bolton-argues-war-with-iran-only-way-to-avenge-american-1835704580|9||1564184060.0|1
1493|The Master At Her Canvas: Mom Just Brought In A Pretty Average-Looking Rock From The Woods That She Says She Will Use In A ‘Project’|750|cet6zi|TheOnion|https://news.clickhole.com/the-master-at-her-canvas-mom-just-brought-in-a-pretty-1836210045|3||1563488907.0|1
1494|Papa John’s Removes N-Word From Menus|746|abzfpm|TheOnion|https://www.theonion.com/papa-john-s-removes-n-word-from-menus-1827552298|19||1546502139.0|1
1495|Lincoln Memorial Empty After Former President’s Statue Furloughed|740|agmf2n|TheOnion|https://politics.theonion.com/lincoln-memorial-empty-after-former-president-s-statue-1831802254|6||1547682506.0|1
1496|Man’s Family Rises To Record-High Fourth Priority|745|a0j1bw|TheOnion|https://local.theonion.com/man-s-family-rises-to-record-high-fourth-priority-1819577274?utm_campaign=SF&utm_content=Main&utm_source=Twitter&utm_medium=SocialMarketing|8||1543265180.0|1
1497|Heartbreaking: The Thing You Want Is All The Way Over There|740|9itcsk|TheOnion|https://www.clickhole.com/heartbreaking-the-thing-you-want-is-all-the-way-over-t-1828987073|2||1537919773.0|1
1498|Roadmap To Peace: Necco Has Set Aside A Roll Of Wafers For Israel And Palestine To Share Only After They Achieve A Two-State Solution|743|8trav1|TheOnion|https://www.clickhole.com/roadmap-to-peace-necco-has-set-aside-a-roll-of-wafers-1826271693|18||1529968489.0|1
1499|This Amazing New Product Called ‘Monocle Glue’ Ensures Your Monocle Won’t Go Flying Off Your Face When Your Daughter Tells You She’s Marrying A Commoner|745|8k54zm|TheOnion|https://www.clickhole.com/this-amazing-new-product-called-monocle-glue-ensures-1825713016|9||1526599893.0|1
1500|‘I’ll Make Those Bastards Pay,’ Teary-Eyed Mueller Whispers Into Locket Containing Photo Of James Comey|746|79qo3s|TheOnion|https://politics.theonion.com/i-ll-make-those-bastards-pay-teary-eyed-mueller-whis-1819984107|1||1509425758.0|1
1501|Dad Can’t Believe Lawn Didn’t Get Him Anything For Father’s Day|745|c1g1ep|TheOnion|https://local.theonion.com/dad-can-t-believe-lawn-didn-t-get-him-anything-for-fath-1819575133|9||1560753973.0|1
1502|Desperate Catholic Church Now Offering Sainthood To Anyone Who Regularly Attends Weekly Mass|743|bg0l2d|TheOnion|https://www.theonion.com/desperate-catholic-church-now-offering-sainthood-to-any-1819576218?utm_content=Main&utm_medium=SocialMarketing&utm_campaign=SF&utm_source=Twitter|17||1555958490.0|1
1503|Americans Observing 911 By Trying Not To Masturbate|736|9ew2hp|TheOnion|https://www.youtube.com/watch?v=dRoVFK2XkN0|13||1536687681.0|1
1504|Fallen Firefighter Remembered As Idiot Who Sucked At His Job|738|9w15k2|TheOnion|https://local.theonion.com/fallen-firefighter-remembered-as-idiot-who-sucked-at-hi-1819574741?utm_source=Twitter&utm_content=Main&utm_campaign=SF&utm_medium=SocialMarketing&__twitter_impression=true&__twitter_impression=true|15||1541940621.0|1
1505|Florida To Experiment With New 600-Lever Voting Machine|739|9rjbaw|TheOnion|https://www.youtube.com/watch?v=MmPtfy9P714|9||1540575944.0|1
1506|Modern-Day Caligula Orders Everything Bagel|737|ax7nwq|TheOnion|https://www.theonion.com/modern-day-caligula-orders-everything-bagel-1819575950?utm_content=Main&utm_source=Twitter&utm_medium=SocialMarketing&utm_campaign=SF|11||1551738221.0|1
1507|Brave Mountain Lion Fends Off Group Of Hikers|732|b8hp42|TheOnion|https://www.theonion.com/brave-mountain-lion-fends-off-group-of-hikers-1819570094?utm_content=Main&utm_source=Twitter&utm_campaign=SF&utm_medium=SocialMarketing|5||1554231399.0|1
1508|Small Town Throws Pride Parade For Only Gay Resident|732|bt0nca|TheOnion|https://youtu.be/QckK4WzKGOk|21||1558852960.0|1
1509|Old Man With Foggy Eye Not Even Magical|728|854hq0|TheOnion|https://local.theonion.com/old-man-with-foggy-eye-not-even-magical-1823386160|1||1521330047.0|1
1510|Man Gains New Disdain For Band After Seeing Them Live|725|cl4sk4|TheOnion|https://local.theonion.com/man-gains-new-disdain-for-band-after-seeing-them-live-1836907932|29||1564784685.0|1
1511|Trump Slams Worldwide Jewish Conspiracy For Not Doing More To Prevent Synagogue Shooting|727|9twbzh|TheOnion|https://politics.theonion.com/trump-slams-worldwide-jewish-conspiracy-for-not-doing-m-1830077401?utm_medium=SocialMarketing&utm_content=Main&utm_source=Twitter&utm_campaign=SF|14||1541297727.0|1
1512|Probably Bullshit But Still A Little Scary: Ethan Is Claiming That His Super Soaker Is Filled With Pee|727|7vgxnx|TheOnion|http://www.clickhole.com/article/probably-bullshit-still-little-scary-ethan-claimin-7296|14||1517885322.0|1
1513|Light Beer Healthiest Food Option At Stadium|727|be95zx|TheOnion|https://sports.theonion.com/light-beer-healthiest-food-option-at-stadium-1834109771|11||1555543863.0|1
1514|Concentric Circles Emanating From Glowing Red Dot|727|8wa46q|TheOnion|https://www.youtube.com/watch?v=8wHMaJ6AtNs|6||1530823177.0|1
1515|Congress Approves $540 Million For Evil|724|8p7xvu|TheOnion|https://politics.theonion.com/congress-approves-540-million-for-evil-1819564550|18||1528380491.0|1
1516|Unambitious Loser With Happy, Fulfilling Life Still Lives In Hometown|726|82fu58|TheOnion|https://local.theonion.com/unambitious-loser-with-happy-fulfilling-life-still-liv-1819575312|10||1520378603.0|1
1517|Sullen Jeff Sessions Scrolls Through Minority Incarceration Statistics To Cheer Self Up|722|6pwose|TheOnion|http://www.theonion.com/article/sullen-jeff-sessions-scrolls-through-minority-inca-56496|20||1501198239.0|1
1518|First Automated Foxconn Machine Immediately Tries To Commit Suicide|723|alukbw|TheOnion|https://www.theonion.com/first-automated-foxconn-machine-immediately-tries-to-co-1832242264|8||1548999469.0|1
