|title|score|id|subreddit|url|num_comments|body|created|Onion?
0|Louisiana eye doctor offers free eye exams for NFL referees after Saints loss|114314|aic7pm|nottheonion|https://www.wwltv.com/article/sports/nfl/saints/louisiana-eye-doctor-offers-free-eye-exams-for-nfl-referees-after-saints-loss/289-e2f3c314-1268-4708-8b5a-5ea445099589|2102||1548119700.0|0
1|Man rescued from Taliban didn't believe Donald Trump was President|103948|76rjtv|nottheonion|http://www.newsweek.com/man-rescued-taliban-didnt-believe-trump-was-president-685861|5288||1508199351.0|0
2|Nat Geo hires Jeff Goldblum to walk around, being professionally fascinated by things|100841|923ww4|nottheonion|https://news.avclub.com/nat-geo-hires-jeff-goldblum-to-walk-around-being-profe-1827880447|1537||1532652354.0|0
3|Black security guard who stops shooter is then shot and killed by police|100021|9wl2d7|nottheonion|https://thehill.com/homenews/news/416255-black-security-guard-stops-shooter-then-is-shot-by-police-while-holding?fbclid=IwAR272RpyOKecaxjCi0ec0aIMm8q7bsoUl7EoeYnhjBqXM0hg7hcLvWfmyCY|2399||1542106035.0|0
4|Hunter dies after shot elephant falls on him|95387|6cgr3h|nottheonion|http://www.news24.com/SouthAfrica/News/hunter-dies-after-shot-elephant-falls-on-him-20170521?|1712||1495405213.0|0
5|Mike Pence Once Ratted Out His Fraternity Brothers For Having a Keg|92180|7hs0t0|nottheonion|http://www.newsweek.com/mike-pence-once-ratted-out-his-fraternity-brothers-having-keg-735711|5286||1512530259.0|0
6|Reddit CEO tells user, “we are not the thought police,” then suspends that user|89790|8xirko|nottheonion|https://arstechnica.com/information-technology/2018/07/reddit-ceo-tells-user-we-are-not-the-thought-police-then-suspends-that-user/|6881||1531212903.0|0
7|R.I.P. astronaut John Young, the first man to get yelled at for smuggling a sandwich into space|88492|7otjwu|nottheonion|https://www.avclub.com/r-i-p-astronaut-john-young-the-first-man-to-get-yelle-1821845571|1114||1515389837.0|0
8|Trump dedicates golf trophy to hurricane victims|85606|73oxkd|nottheonion|http://thehill.com/homenews/administration/353355-trump-dedicates-golf-trophy-to-puerto-rico-hurricane-victims|6793||1506926989.0|0
9|Hipster whines at tech mag for using his pic to imply hipsters look the same, discovers pic was of an entirely different hipster|84712|axz8rp|nottheonion|https://www.theregister.co.uk/2019/03/06/hipsters_all_look_the_same_fact/|2136||1551910323.0|0
10|President Trump: I would have run into school during shooting ‘even if I didn’t have a weapon’|83601|80eui1|nottheonion|http://www.tampabay.com/florida-politics/buzz/2018/02/26/president-trump-i-would-have-run-into-school-during-shooting-even-if-i-didnt-have-a-weapon/|9383||1519695672.0|0
11|Ben Affleck finally achieves lifelong dream of not having to play Batman anymore|81752|alpp8e|nottheonion|https://news.avclub.com/ben-affleck-finally-achieves-lifelong-dream-of-not-havi-1832214950|3122||1548971990.0|0
12|EA: They’re not loot boxes, they’re “surprise mechanics,” and they’re “quite ethical”|75678|c2jp75|nottheonion|https://www.pcgamesn.com/ea-loot-boxes|5234||1560992954.0|0
13|ICE Director: ICE Can't Be Compared To Nazis Since We're Just Following Orders|75611|8sg0sj|nottheonion|https://politicsmaven.io/theintellectualist/news/ice-director-ice-can-t-be-compared-to-nazis-since-we-re-just-following-orders-gUCVH4E1CUi5Y73kZqpeNA/|6227||1529504090.0|0
14|Uber’s search for a female CEO has been narrowed down to 3 men|75485|6rsj7o|nottheonion|http://www.denverpost.com/2017/08/05/uber-search-female-ceo-men-finalists/|6374||1501977733.0|0
15|Dogs cannot get ‘autism’, British Veterinary Association warns after ‘anti-vaxx’ movement spread to pets|74979|8etnji|nottheonion|https://www.telegraph.co.uk/news/2018/04/25/dogs-cannot-get-autism-british-veterinary-association-warns/|3100||1524692641.0|0
16|Somali Militant Group Al-Shabaab Announces Ban On Single-Use Plastic Bags|74302|8vpvoj|nottheonion|https://www.pedestrian.tv/news/al-shabaab-plastic-bag-ban/|2006||1530626889.0|0
17|United Nations official visiting Alabama to investigate 'great poverty and inequality'|74088|7i0xl0|nottheonion|http://www.al.com/news/index.ssf/2017/12/united_nations_official_visiti.html#incart_river_home|6066||1512621577.0|0
18|Florida House declares porn a public health risk shortly after denying assault rifle ban|73056|7z7ud1|nottheonion|http://thehill.com/homenews/state-watch/374816-florida-house-votes-to-declare-porn-a-public-health-risk-within-an-hour|5771||1519266872.0|0
19|Passenger turned away from two flights after wearing 10 layers of clothing to avoid luggage fee|72985|7qucjv|nottheonion|http://www.telegraph.co.uk/news/2018/01/16/passenger-turned-away-two-flights-wearing-10-layers-clothing/|3424||1516156044.0|0
20|Congress To Make Members Pay Out Of Pocket For Sexual Harassment Settlements|72601|a5um6y|nottheonion|https://www.npr.org/2018/12/12/676209258/congress-to-make-members-pay-out-of-pocket-for-sexual-harassment-settlements|1708||1544744718.0|0
21|Woman Named Marijuana Pepsi, Who Refused To Change Her Name, Earns Her Ph.D After Completing Dissertation On Black Names|72490|c2sydw|nottheonion|https://blavity.com/woman-named-marijuana-pepsi-who-refused-to-change-her-name-earns-her-phd-after-completing-dissertation-on-black-names|5314||1561044056.0|0
22|Sean Spicer says Oprah Winfrey Doesn’t Have the Political Experience to be President|70151|7p4drn|nottheonion|http://www.itv.com/goodmorningbritain/news/sean-spicer-says-oprah-winfrey-doesnt-have-the-political-experience-to-be-president|6274||1515498110.0|0
23|White House press secretary attacks media for accurately reporting inauguration crowds|69602|5pdqvm|nottheonion|http://money.cnn.com/2017/01/21/media/sean-spicer-press-secretary-statement/index.html|10783||1485070936.0|0
24|UPS loses Family’s $846K Inheritance, Offers to Refund $32 Shipping Fee|69584|7jx5td|nottheonion|http://www.newsweek.com/ups-loses-846k-inheritance-offer-refund-shipping-fee-748764|3149||1513338079.0|0
25|School boy takes MICROWAVE to school to carry books after school bans bags|69135|9qfrz1|nottheonion|https://www.lincolnshirelive.co.uk/news/local-news/school-boy-takes-microwave-school-2135169|3044||1540256767.0|0
26|Alabama lawmaker: We shouldn't arm teachers because most are women|67659|84pv7l|nottheonion|http://www.al.com/news/index.ssf/2018/03/women_scare_of_guns.html|3930||1521175802.0|0
27|Marilyn Manson Mourned On Twitter, Confusing Him For Dead Mass Murderer Charles|67616|7ec1pg|nottheonion|http://www.newsweek.com/marilyn-manson-dead-charles-mass-murderer-die-717318|3328||1511239789.0|0
28|Trump calls Warren 'Pocahontas' at event honoring Native American veterans|67344|7fxz37|nottheonion|http://thehill.com/homenews/administration/361990-trump-calls-warren-pocahontas-at-event-honoring-native-american|3941||1511841728.0|0
29|Cat named after Notorious B.I.G. shot multiple times — and survives|66825|7f1kxc|nottheonion|http://www.cbc.ca/news/canada/british-columbia/notorious-b-i-g-the-cat-survives-shooting-1.4415169|2007||1511490980.0|0
30|No, this isn't The Onion, Yes Net Neutrality is under attack and we have less than a month to save it. Fight to save Net Neutrality today!|66608|7epgmr|nottheonion|http://www.battleforthenet.com|668||1511368356.0|0
31|Saudi Arabia declares online satire punishable offence|66597|9cwi0q|nottheonion|https://www.france24.com/en/20180904-saudi-arabia-declares-online-satire-punishable-offence|1488||1536102722.0|0
32|American parents say their children are speaking in British accent after watching too much Peppa Pig|65205|apu3un|nottheonion|https://www.itv.com/news/2019-02-12/american-children-develop-british-accent-after-watching-peppa-pig/|4226||1550012060.0|0
33|Trump Says Energy-Efficient Light Bulbs Make Him 'Look Orange,' Complains About How Expensive They Are|65187|d3o9x6|nottheonion|https://www.newsweek.com/trump-energy-efficient-light-bulbs-orange-incandescent-expensive-1459081|4318||1568405235.0|0
34|EPA Head Says He Needs to Fly First Class Because People Are Mean to Him in Coach|65055|7xm3fq|nottheonion|http://time.com/5158661/scott-pruitt-first-class/|711||1518677686.0|0
35|Cards Against Humanity buys plot of land on U.S./Mexico border to block border wall|64819|7czknr|nottheonion|http://www.khq.com/story/36844143/cards-against-humanity-buys-plot-of-land-on-usmexico-border-to-block-border-wall|4948||1510728964.0|0
36|Apology after Japanese train departs 20 seconds early|64723|7dblzz|nottheonion|https://www.bbc.co.uk/news/amp/world-asia-42009839|3058||1510857763.0|0
37|Justin Bieber banned from China in order to 'purify' nation|64615|6on1su|nottheonion|http://www.telegraph.co.uk/music/news/controversial-justin-bieber-banned-china-order-purify-nation/|3132||1500661390.0|0
38|Alcohol level in air at fraternity party registers on Breathalyzer|64413|7l2fiv|nottheonion|http://6abc.com/alcohol-in-air-at-frat-party-registers-on-breathalyzer/2802898/?sf176857834=1|1986||1513815845.0|0
39|Always look on the bright side of life, says CEO who raised EpiPen price by more than 400%|64284|8oq62o|nottheonion|http://www.latimes.com/business/lazarus/la-fi-lazarus-mylan-epipen-drug-prices-20180605-story.html|993||1528228308.0|0
40|Trump calls Dems who didn't clap during State of the Union 'treasonous' and 'un-American'|64251|7vognj|nottheonion|https://www.yahoo.com/news/trump-calls-dems-didnt-clap-state-union-treasonous-un-american-210114640.html|7986||1517963142.0|0
41|NPR tweets the Declaration of Independence, and people freak out about a ‘revolution’|64024|6lffoc|nottheonion|http://www.kansascity.com/news/nation-world/article159682299.html|7389||1499303846.0|0
42|Five guys arrested after fist fight at Five Guys|63994|ceut6s|nottheonion|https://www.orlandosentinel.com/news/crime/os-ne-five-guys-fight-20190718-py2wtkmdo5e5zohhobzco7a5ce-story.html|905||1563496532.0|0
43|McDonald's worker fired for refusing to serve paramedics: 'We don't serve your kind here'|62421|clj037|nottheonion|https://www.newsweek.com/mcdonalds-worker-fired-paramedic-refused-service-1452268|6551||1564869278.0|0
44|Missouri man must watch ‘Bambi’ monthly as part of poaching punishment, judge rules|62184|a70akr|nottheonion|https://www.foxnews.com/great-outdoors/missouri-man-must-watch-bambi-monthly-as-part-of-poaching-punishment-judge-rules|1713||1545085971.0|0
45|Melania flew to Texas to visit immigrant children wearing a jacket that says 'I really don't care, do u?'|62179|8suhhk|nottheonion|https://www.businessinsider.in/Melania-flew-to-Texas-to-visit-immigrant-children-wearing-a-jacket-that-says-I-really-dont-care-do-u/articleshow/64688477.cms|3770||1529635952.0|0
46|Man who mowed lawn with tornado behind him says he 'was keeping an eye on it.'|61483|6f4vk9|nottheonion|http://www.timescolonist.com/man-who-mowed-lawn-with-tornado-behind-him-says-he-was-keeping-an-eye-on-it-1.20394290|1611||1496569457.0|0
47|Michael B. Jordan buys teen a new retainer after she bit through it during his shirtless Black Panther scene|61111|82qinj|nottheonion|https://www.avclub.com/michael-b-jordan-buys-teen-a-new-retainer-after-she-bi-1823581527|1919||1520476112.0|0
48|Ferry McFerryface to be name of new Sydney ferry after public vote|60821|7cm6r5|nottheonion|http://www.abc.net.au/news/2017-11-13/sydney-ferry-will-actually-be-called-ferry-mcferryface/9146446|1879||1510596579.0|0
49|France Protests: Police threaten to join protesters, demand better pay and conditions|60803|a7uv1r|nottheonion|https://www.newsweek.com/france-protests-police-strike-gilets-jaunes-yellow-vests-pay-overtime-1264961|3453||1545313345.0|0
50|British politician wants death penalty for suicide bombers|60649|6dfsd7|nottheonion|http://www.news.com.au/world/europe/british-politician-wants-death-penalty-for-suicide-bombers/news-story/0eec0b726cef5848baca05ed1022d2ca|3131||1495817699.0|0
51|Missouri Republican Who Said ‘Hitler Was Right’ Wins State House Primary|60395|97b7ai|nottheonion|https://www.jpost.com//American-Politics/Missouri-Republican-who-said-Hitler-was-right-wins-state-House-primary-564637|3155||1534302591.0|0
52|Texas Students Will Soon Learn Slavery Played a Central Role in the Civil War|60312|9xrdj2|nottheonion|https://www.npr.org/2018/11/16/668557179/texas-students-will-soon-learn-slavery-played-a-central-role-in-the-civil-war|3895||1542439510.0|0
53|US Republicans endorse arming toddlers on Sacha Baron Cohen show|60233|8zb638|nottheonion|https://www.aljazeera.com/news/2018/07/republicans-endorse-arming-toddlers-sacha-baron-cohen-show-180716070900037.html|5617||1531778688.0|0
54|A man harasses a woman for wearing a Puerto Rico shirt, saying it's 'un-American'|60129|8xquao|nottheonion|https://edition.cnn.com/2018/07/10/us/illinois-puerto-rico-park-officer/index.html|4850||1531269081.0|0
55|Michael Cohen paid IT firm to tweet that he was sexy|59372|ah0l46|nottheonion|https://www.theguardian.com/us-news/2019/jan/17/michael-cohen-paid-firm-tweet-sexy|1138||1547777408.0|0
56|The number of Delta Air Lines passengers who bought tickets with NRA discount: 13|59012|81gusw|nottheonion|http://www.wtsp.com/article/news/nation-now/the-number-of-delta-air-lines-passengers-who-bought-tickets-with-nra-discount-13/465-f3c2431b-ec3d-469e-8799-5060e998ecb2|3755||1520046351.0|0
57|Alt-Right White Supremacists Claim Papa John's as Official Pizza|58965|7aqklg|nottheonion|http://www.newsweek.com/papa-john-alt-right-nazis-white-supremacists-nfl-pizza-701648|7004||1509830232.0|0
58|White supremacists taking DNA tests sad to discover they’re not 100% white|58907|6un2rj|nottheonion|http://globalnews.ca/news/3680678/white-supremacists-dna-study/|5214||1503145337.0|0
59|After eating Chipotle for 500 days, an Ohio man says he's ready for something new|57835|84w1f8|nottheonion|http://katu.com/news/nation-world/after-eating-chipotle-for-500-days-an-ohio-man-says-hes-ready-for-something-new|2461||1521241097.0|0
60|Weatherman Jamie Simpson Tells Viewers to Stop Complaining About Tornado Warnings Interrupting 'The Bachelorette': 'This Is Pathetic'|57610|bu2fco|nottheonion|https://www.newsweek.com/weatherman-jamie-simpson-fox-45-complaining-tornado-warnings-bachelorette-1436953|2316||1559091327.0|0
61|School turns students' lunch debt over to collection agency|57292|a4enl9|nottheonion|https://www.nbc4i.com/news/u-s-world/school-turns-students-lunch-debt-over-to-collection-agency/1645349811|4758||1544332498.0|0
62|‘El Chapo’ promises not to kill any jurors from upcoming federal trial|57077|7szhgm|nottheonion|http://wgntv.com/2018/01/25/el-chapo-promises-not-to-kill-any-jurors/|3200||1516944237.0|0
63|Poll: Kim Jong Un has higher approval among Republicans than Pelosi|57073|8s0yx3|nottheonion|http://thehill.com/homenews/house/392756-poll-kim-jong-un-has-higher-approval-among-republicans-than-pelosi|5578||1529368963.0|0
64|After 4th DWI, man argues legal limit discriminates against alcoholics|56945|7x12r0|nottheonion|http://www.statesman.com/news/after-4th-dwi-man-argues-legal-limit-discriminates-against-alcoholics/7M59MPAdu5WImE2s9tTuPP/|3848||1518474592.0|0
65|Since Jay-Z put out an album called 4:44, Jersey prog band 4:44 put out an album called Jay-Z|56893|6ptftc|nottheonion|http://thekey.xpn.org/2017/07/25/jay-z-444-444-jay-z/|1083||1501156120.0|0
66|Palestinian judge bans divorce during Ramadan because ‘people make hasty decisions when they’re hungry’|56567|6dzu2h|nottheonion|http://www.independent.co.uk/news/world/middle-east/ramadan-divorce-banned-palestinian-judge-people-hasty-decisions-hungry-smoke-cigarettes-mahmoud-al-a7761056.html|2774||1496087308.0|0
67|Argentinian officers fired after claiming mice ate half a ton of missing marijuana|56346|8bicsf|nottheonion|https://www.theguardian.com/world/2018/apr/11/argentinian-police-officers-dismissed-after-claiming-mice-ate-marijuana?CMP=twt_gu|1262||1523492453.0|0
68|Detective Pikachu cinematographer happy his CGI monstrosities less obviously awful than Sonic's|55800|bl1nbc|nottheonion|https://news.avclub.com/detective-pikachu-cinematographer-happy-his-cgi-monstro-1834528912|1523||1557112021.0|0
69|Harambe: Stop making memes of our dead gorilla, Cincinnati Zoo pleads|55694|4z07o6|nottheonion|http://www.independent.co.uk/life-style/gadgets-and-tech/news/harambe-memes-cincinnati-zoo-gorilla-shot-dead-rip-a7203356.html|4851||1471896414.0|0
70|"Jeff Sessions: Marijuana Is ""Only Slightly Less Awful"" Than Heroin"|55514|5zlct1|nottheonion|http://www.bostonmagazine.com/news/blog/2017/03/15/jeff-sessions-marijuana-slightly-less-awful-heroin/|7216||1489633129.0|0
71|DC bars to open early for Comey hearing watch parties|55391|6ftvco|nottheonion|http://wtop.com/dc/2017/06/14136931/slide/1/|3748||1496875545.0|0
72|Florida Mayor Arrested Just Weeks After Taking Over for Florida Mayor Who was Arrested|55248|b17tru|nottheonion|https://newsbreakinglive.com/2019/03/14/florida-mayor-arrested-just-weeks-after-taking-over-for-florida-mayor-who-was-arrested/|1488||1552636790.0|0
73|Former Barney the Dinosaur actor now works as a controversial tantric sex guru|55133|7sn5k6|nottheonion|http://www.telegraph.co.uk/tv/2018/01/24/former-barney-dinosaur-actor-now-works-controversial-tantric/|2361||1516830271.0|0
74|Massive cow named Knickers has been deemed too large to eat|55014|a0zba8|nottheonion|https://globalnews.ca/news/4703769/cow-knickers-slaughterhouse/|2155||1543383316.0|0
75|Trump gets a folder full of positive news about himself twice a day|54738|6shoh1|nottheonion|https://news.vice.com/story/trump-folder-positive-news-white-house|4095||1502265661.0|0
76|“An almond doesn’t lactate:” FDA to crack down on use of the word “milk”|54668|9022wd|nottheonion|https://arstechnica.com/tech-policy/2018/07/an-almond-doesnt-lactate-fda-to-crack-down-on-use-of-the-word-milk/|4135||1531998012.0|0
77|NYPD Union Sues To Stop Release Of All Bodycam Footage Because It Violates Officers’ Civil Rights|54496|7qpq3u|nottheonion|https://lawandcrime.com/police/nypd-union-sues-to-stop-release-of-all-bodycam-footage-because-it-violates-officers-civil-rights/|4881||1516104430.0|0
78|EU warns Turkey after it violates Greek airspace 141 times in one day|54353|6boqaw|nottheonion|https://www.euractiv.com/section/enlargement/news/eu-warns-turkey-after-it-violates-greek-airspace-141-times-in-one-day/|745||1495057037.0|0
79|Texas prisons deny dentures to inmates with no teeth, claim chewing 'isn't a medical necessity'|54126|9irn5c|nottheonion|https://www.wnct.com/news/national/texas-prisons-deny-dentures-to-inmates-with-no-teeth-claim-chewing-isn-t-a-medical-necessity-/1473312082|3510||1537906947.0|0
80|The man who stole a plane said he didn't need much help: 'I've played some video games'|54117|96hi5z|nottheonion|https://www.cnn.com/2018/08/11/us/seattle-stolen-plane-audio-recording/index.html|3728||1534031397.0|0
81|Tiananmen Square Massacre: China Says U.S. Is Violating International Law By Honoring 30th Anniversary|53957|bwtbav|nottheonion|https://www.newsweek.com/tiananmen-square-massacre-china-says-us-violating-international-law-honoring-30th-anniversary-1442014|2745||1559707298.0|0
82|White House blocks CNN, BBC, New York Times, LA Times from media briefing|53878|5w07ne|nottheonion|http://www.independent.co.uk/news/world/americas/white-house-blocks-news-outlets-from-media-briefing-a7598641.html|2771||1488000258.0|0
83|'Nobody kill anybody': Murder-free weekend urged in Baltimore|53819|6o4ids|nottheonion|http://www.baltimoresun.com/news/maryland/baltimore-city/bs-md-ci-ceasefire-20170718-story.html|2141||1500448177.0|0
84|Tobacco company Philip Morris starts life insurance firm that offers discounts to smokers who quit|53559|bgkkb4|nottheonion|https://www.cnbc.com/2019/04/23/tobacco-company-philip-morris-launches-life-insurance-company-reviti.html|1506||1556076528.0|0
85|Group of teen girls tries to set trap for alleged pedophile; one ends up kidnapped|53191|df0a98|nottheonion|https://www.wtap.com/content/news/Group-of-teen-girls-tries-to-set-trap-for-alleged-pedophile-one-ends-up-kidnapped-562505861.html|3609||1570571712.0|0
86|Papa John's blames NFL, anthem protests for falling pizza sales|52594|7a4oyr|nottheonion|http://www.theindychannel.com/news/national/papa-john-s-blames-nfl-anthem-protests-for-falling-pizza-sales|8472||1509582493.0|0
87|Teacher Of The Year In Oklahoma Moves To Texas For The Money|52436|6ktzx1|nottheonion|http://www.npr.org/sections/ed/2017/07/02/531911536/teacher-of-the-year-in-oklahoma-moves-to-texas-for-the-money|4831||1499040459.0|0
88|Macaulay Culkin to legally change his middle name to Macaulay Culkin|52164|a9zlxv|nottheonion|https://wgntv.com/2018/12/27/macaulay-culkin-to-legally-change-his-middle-name-to-macaulay-culkin/|2454||1545949446.0|0
89|Pakistani girl who died in Texas shooting ‘wanted to experience American culture’|51733|8kzq7k|nottheonion|http://indianexpress.com/article/world/pakistani-girl-who-died-in-texas-shooting-wanted-to-experience-american-culture-5185008/|2117||1526926379.0|0
90|Family forced to sit on plane floor after airline allocated them seats which didn't exist, it emerges|51727|afmp7f|nottheonion|https://www.telegraph.co.uk/news/2019/01/13/family-forced-sit-plane-floor-airline-allocated-seats-didnt/|1703||1547435930.0|0
91|Michelin Star Restaurant Owner Invited Clemson Tigers To Experience 'What An Actual Celebration Dinner Should Be'|51632|agpslw|nottheonion|https://www.newsweek.com/three-star-michelin-restaurant-ayesha-curry-clemson-tigers-dinner-1294437|2574||1547701519.0|0
92|Suspected murderer who evaded capture for 12 years by pretending to be mute loses voice from underuse|51418|7m24z1|nottheonion|http://www.telegraph.co.uk/news/2017/12/25/suspected-murderer-evaded-capture-12-years-pretending-mute-loses/|1408||1514248023.0|0
93|Bill Cosby Gets Vanilla Pudding in Jail for First Meal Behind Bars|51330|9iwvod|nottheonion|https://theblast.com/bill-cosby-first-meal-jail-pudding/|2722||1537944160.0|0
94|Thousands unfollow Sen. John McCain after he asks for more Twitter followers|51322|7hndqf|nottheonion|http://tucson.com/news/state-and-regional/thousands-unfollow-sen-john-mccain-after-he-asks-for-more/article_c6548042-d94b-11e7-aef2-7fa7e36b0339.html|2305||1512477954.0|0
95|Iceland's president admits he went 'too far' with threat to ban pineapple pizza|51308|9x6f8b|nottheonion|https://www.cbc.ca/radio/asithappens/iceland-s-president-admits-he-went-too-far-with-threat-to-ban-pineapple-pizza-1.4905000|2235||1542274115.0|0
96|Texas judge interrupts jury, says God told him defendant is not guilty|51274|7rkbu1|nottheonion|http://www.statesman.com/news/crime--law/texas-judge-interrupts-jury-says-god-told-him-defendant-not-guilty/ZRdGbT7xPu7lc6kMMPeWKL/|1912||1516414882.0|0
97|Speeding Arizona Congressman Claims 'Immunity' When Pulled Over; Brags to Cop He Goes Even Faster|51154|8yjy7n|nottheonion|http://www.newsweek.com/speeding-arizona-congressman-claims-immunity-when-pulled-over-brags-cop-he-1022154|3090||1531517130.0|0
98|The creators of the Nintendo 64 GoldenEye have officially ruled: Oddjob is cheating|51118|99gqbd|nottheonion|https://news.avclub.com/the-creators-of-the-nintendo-64-goldeneye-have-official-1828520705|1751||1534997692.0|0
99|Fox News isn’t worried about millions losing insurance since “we’re all going to die”|51054|6k4ovj|nottheonion|http://newsweek.com/fox-news-president-donald-trump-health-care-republican-gop-were-all-gonna-die-629883|5136||1498723490.0|0
100|After 140 mph chase, man tells police he didn’t think their cruisers could catch his 2002 Acura|51041|d72ano|nottheonion|https://fox59.com/2019/09/19/after-140-mph-chase-man-tells-police-he-didnt-think-their-cruisers-could-catch-his-2002-acura/|2771||1569047972.0|0
101|Bush says Trump ‘makes me look pretty good’ by comparison: report|50831|82fug2|nottheonion|http://thehill.com/homenews/administration/376909-bush-says-trump-makes-me-look-pretty-good-by-comparison-report|3742||1520378678.0|0
102|"Merriam-Webster adds ""sheeple"" to dictionary, cites Apple users as an example"|50720|68fcab|nottheonion|https://vanguarddaily.com/merriam-webster-adds-sheeple-to-dictionary-cites-apple-users-as-an-example/|3421||1493586050.0|0
103|NRA Says New Florida Law Would Take Away Rifles From '10-Year-Old Little Girls' on Their Birthdays|50555|crlikr|nottheonion|https://www.newsweek.com/nra-says-new-florida-law-would-take-away-rifles-10-year-old-little-girls-their-birthdays-1454841|6922||1566073542.0|0
104|'We want sauce': police called after McDonald's Rick and Morty promotion heats up|50473|7511p5|nottheonion|https://www.theguardian.com/business/2017/oct/08/police-called-after-mcdonalds-rick-and-morty-promotion-heats-up?CMP=fb_gu|4706||1507488497.0|0
105|Anti-vaccine advocates appointed to Minnesota autism council after measles outbreak|50314|ajsuij|nottheonion|https://arstechnica.com/science/2019/01/anti-vaccine-advocates-appointed-to-minnesota-autism-council-after-measles-outbreak/|2413||1548474651.0|0
106|France Is Running Out of Butter for Its Croissants|50303|79nb46|nottheonion|https://www.bloomberg.com/news/articles/2017-10-30/french-butter-melts-away-from-shelves-as-global-demand-soars|2504||1509394539.0|0
107|Metalheads with kazoos drown out Westboro Baptist Church at Virginia Capitol.|50248|azwtz3|nottheonion|https://www.virginiamercury.com/blog-va/metalheads-with-kazoos-drown-out-westboro-baptist-church-at-capitol/|1230||1552357597.0|0
108|‘They can't stop all of us': More than 250K pledge to storm Area 51 to uncover alien secrets|50170|cbpkk5|nottheonion|http://www.fox10phoenix.com/news/us-world-news/they-cant-stop-all-of-us-more-than-250k-pledge-to-storm-area-51-to-uncover-alien-secrets|4568||1562837891.0|0
109|Utah teacher fired after showing students classical paintings which contained nudity|50094|7mz5un|nottheonion|https://www.ksl.com/?sid=46226253&nid=148&title=utah-teacher-fired-after-students-see-nudity-in-art|3763||1514632382.0|0
